newspaper,newspaper_ID_histCommons,printer,date,written_date,year,text,notes,written_date,resistance_tag
The South Carolina Gazette,NA,Elizabeth Timothy,1742_04_24,"April 24, 1742",1742,"Yesterday arrived a Mail
from Holland; with the
following Advices of a
Great and sudden
Revolution in the
Governments of the
Muscovite Empire.
HAGUE, December 25.
ON the twenty third Instant
in the Evening an Express
arrived here from
Petersburg, to the Count de
Goloskin, and deliver'd him a
Packet of Letters, dated the
sixth of this Inst. in which
was a formal Order under the
Great Seal, directed to the
said Ambassador, to inform
their High Mightinesses,
""That the States of the
Russias, the Senate, the
Synod, and the other
principal Orders, could bear
no longer to let the Supreme
Authority remain in the
Hands of those, who, by a
long Series of Acts of
Violence, one after another,
had usurp'd it ever since the
Death of the Emperor Peter I.
the Ministers to whom that
Prince had committed the
Execution of his last Will, not
having perform'd it: That in
order to put a Stop to these
Usurpations, and to restore
the Crown to the Lawful Heir
they had unanimously
declar'd the Princess
Elizabeth, Daughter of the
said Emperor, to be their
Sovereign, Sole Monarch, and
Empress: And that her
Imperial Majesty at the same
time gave the strongest
Assurances, that she would
not fail to cultivate that
perfect good Understanding
with this State, which has
subsisted between her
Predecessors and this
Republick; and upon all
Occasions to give it Proofs of
her Affection.""
This Order was sign'd
ELIZABETH.
In pursuance hereof the
Count Goloskin went the
same Night to the Pensionary
Vander Hein, and then to the
Gressier Fagel, to notify the
same to both those Ministers.
His Excellency has received
no other News or Letter
whatsoever, so that we know
not what Changes have been
made in the Ministry, nor
indeed any one Thing that
has been transacted in this
Revolution. All that is given
out is, that the Prince
Nariskin, who is in a sort of
Exile, and now at Paris, will
shortly return to
Petersbourgh; and 'tis
thought the new Empress will
soon declare her Marriage.
Mean time 'tis conjectur'd,
that this Revolution, and the
Resolution the King of
Sardinia has now taken in
favour of the King of Spain
will hasten a general Peace.
In the Count de Goloskin's
Packet came the following
Piece, viz.
The Manifesto of the
Empress Elisabeth, Sovereign
of all the Russia's.
""We Elizabeth I. Empress
and Sovereign of all the
Russias, &c. make known to
all and every one by these
Presents.""
""All the World knows that in
Consequence of the Letters
Parents issued the 16th of
October, 1740, the late Grand
Lady Empress Anne
Joannowna appointed, before
her Decease, her Nephew to
succeed to the Throne of
Russia, who was then but a
few Months old: But,
whereas, on Occasion of his
Minority several Persons
have managed the Affairs of
this Empire in so unbecoming
a Manner that many Troubles
and Inconveniences have
ensued thereby, as well as
home as abroad, and might
have been follow'd by still
greater Mischiefs; our
faithful Subjects, the
Spiritual and Temporal
Estates, and in particular our
Regiments of Guards, have
unanimously invited us to
ascend the Throne of our
Fathers, which by Right
belongs to us as the nearest
Heiress by our Birth, and
thereby to prevent all the
future Troubles that are to be
apprehended: In
Consequence of this
Invitation, and by Vertue of
the Right of Succession,
which belongs to us, and
which we derive from our
most dear Father and
Mother, the Emperor Peter
the Great, and the Great
Lady and Empress Catharine
Alexewna, as likewise to
condescend to the unanimous
Wishes of our faithful
Subjects, we have most
graciously accepted the
paternal Crown and the
Empire of all the Russias, as
will be more amply set forth
in another Manifesto. In the
mean time we have been
pleased to impart this Event
to our faithful Subjects, that
they may in Consequence
thereof take the Oaths of
Allegiance to us.""
Done at Petersburgh, Dec. 6,
1741.
The above extraordinary and
most important Event is
confirm'd from Berlin and
from Hamburgh, with this
additional Circumstance, that
there was an Insurrection
amongst the Populace, who
being supported by the three
Regiments of Guards, the
Dutchess Regent immediately
abdicated the Regency, &c.
But we must wait for the
Particulars of this great
Revolution","On Muscovite revolution, mentions insurrection","April 24, 1742",nonslave
The South Carolina Gazette,NA,Elizabeth Timothy,1742_06_21,"June 21, 1742",1742,"Vienna, February 28. There is
no other News from Bavaria,
except that Count
Khevenhuller has made a
Detachment of Four
Regiments of Foot and Two of
Horse, to reinforce Prince
Charles and Prince
Lobkowitz, in order to enable
them to put a Stop to the
King of Prussia's Progress in
Moravia and Lower Austria.
M. Polastion, with the 3000
French under his Command,
is refitted out of Moravia to
join Marshal Broglio. This
Court has now in its Service,
of the Hungarian
Insurrection, six Regiments
of Infantry, amounting to
18,000 Men, Four of Cavalry
4000, Portalists 2000, Nobility
10000, Three old Regiments
of Hungarians 9000, Eight
Regiments of Hussars 8000,
Croats of Waradin 8000, ditto
of Carlstadt 9000,
Sclavonians 3000, Pandours,
Rascians, &c. 3000, in all
74,000",hungarian insurrection,"June 21, 1742",nonslave
The South Carolina Gazette,NA,Elizabeth Timothy,1742_10_18,"October 18, 1742",1742,"THE Court of Russia,
not only refuses to treat
with Sweden, by the
Mediation of France, but
told the Marquis de la
Chetardie, the French
Ambassador, that the
Mediation of his Court
was neither necessary
nor proper, nor desired.
Nor can it be wondered that
this Answer was given him, if
what is related is true, that a
Conspiracy had been
discovered, which had been
formed by him against the
Czarina, for which 100
Persons have been seized.
However, Sweden appears
now more desirous of Peace
than to prosecute War, a
favourable Reception has
been given to the new
Proposals which she has
made. The Swedish Garrison
at Fredericksham, after
setting Fire, having left it in
Flames, the Russian Hussars
entered the Town on the 19th
Instant, and extinguished
them.
Price Charles of Lorrain has
his Head Quarters at
Konigshal, nor far from
Prague, and having received
his heavy Artillery and a
Reinforcement from Moravia
of 16000 Men, under General
Festituz, is preparing to
attack the French Troops,
which the Loss of 6000 in
their late precipitate Retreat,
has reduced, notwithstanding
their late Supplies, to 15000
Men, who altogether with the
Garrison, are reduced to
great Distress, having been
obliged to kill their Horses
for Food. Marshal Broglio
has forbidden the Burghers
of Prague to go out of the
City under Pain of Death,
and caused Piles of Faggots to
be raised in the Streets, in
orded to set Fire to them in
Case they make the least
Resistance. In this Miserable
Condition Broglio sent
positive Orders to the Duke
d'Harcourt in Bavaria, to
march immediately into
Bohemia with all his Forces.
But as such a precipitate
March, with Count
Khevenhuller at his Rear,
must inevitably ruin the
Army; and as he could only
join Broglio by defeating the
Austrians, he resolved to
continue where he was. Their
next Recourse was to
Negotiation, in which
Marshal Belle-Isle offered
Felt Marshal Konigsegg, to
deliver up Prague to the
Austrians, provided the
French Garrison were
allowed to march out with
their Arms, Baggage, and all
the Honours of War, and to
join the rest of the Army,
which would immediately
evacuate Bohemia. But
Konigsegg insisted that the
Garrison should surrender
Prisoners of War. Since
Prince Charles of Lorrain has
received his Artillery and
Reinforcements, he has
absolutely refused any
Capitulation either to the
Garrison or to the Army.
It appears now that the
French Army is left alone to
withstand the Fury of the
exasperated Austrians. For
the King of Prussia having
had a Copy of Marshal
Broglio's Dispatches of the
fourth of May sent to him,
the Treachery of France was
visible enough, but his
Majesty did not think it
possible. Those Dispatches
inform'd Marshal Broglio of
a Reinforcement of 5000 Men
sending him by his Court.
They likewise contain'd
Instructions for regulating
the Conduct of that General,
and of the Use he was to
make of his Forces. By the 1st
Instruction the Court
expressly forbids him to mix
his Troops with those of his
Prussian Majesty. The 2d
directs him to spare his Army
as much as he could, and to
act always in a different
Quarter from the Prussians.
The 3d orders him to always
preserve a Body of 20 or
25000 of the best Troops in
order to cover and observe
the Prussian Army, as well in
a Siege, as in a general
Action. By the 4th, he is
directed to employ his Body
in closely examining into the
Conduct of that Prince, and
the Steps and Motions of his
Army, for Causes and
Reasons of great Importance.
By the 5th he is order'd to
hazard nothing, under
Pretence that neither the
French Reinforcement was
yet arrived at the Army, nor
the Marshal de Belle-Isle,
who only had Orders from
his Most Christian Majesty to
command with the King of
Prussia.
His Prussian Majesty at that
Time gave no Heed to these
salutary Warnings, beleiving
them to come from the
Enemy's Quarter; and
instead of withdrawing from
his Camp, as he ought to have
done, on the Contrary he
gave Prince d'Anhalt Orders
to hasten his March, in order
to join him in his Came of
Czaslaw; where Marshal
Broglio was, according to his
Promise, to come with his
army in two Days, but who
never came.
The King of Prussia having
four Days after been alone
obliged to sustain the Battle
of Czaslaw, at which he lost
13000 effective Men, he
discover'd, tho' too late, that
France was deceiving him,
and that his Army was
certainly to be sacrificed.
The Inhabitants of the
Dutchy of Cleves being
apprehensive of the French,
the King of Prussia is
forming there a Body of
30,000 Men, for their
Protection, that Monarch
does not omit to cultivate the
Commerce of his new
Subjects in Silesia, having
settled two great Fairs, which
he ordered to be published in
the London Gazette for the
Merchants of Great Britain to
frequent them.
The Preliminary Articles of
Peace are settled between
their Hungarian and Polish
Majesties; whereby the
Queen of Hungary cedes to
the King of Poland some
Districts in Bohemia, and the
King guarantees to the Queen
the rest of Bohemia, and all
her other Dominions,
promises to accede to the
Treaty of Breslaw, within a
certain Term, and engages to
assist her with 22,000 Men
when required. The Saxen
Troops has retired from
Bohemia the 28th past.
Her Hungarian Majesty in
her Letters to her Ministers
at foreign Courts to acqaint
them with the Treaty of
Breslaw, expresses herself in
this Manner, ""I only
consented to this Peace and to
the Sacrifice which I made of
Silesia, for the good of the
Empire, and to be in a
Condition so to drive out its
Enemies and mine. I flatter
myself the Empire will
acknowledge this Sacrifice in
a proper Manner, and assist
me with all its Forces to
procure me an Equivalent for
the Loss I have sustain'd, and
counterbalance the Prejudice
which the Equilibrium might
suffer from it.""
The Emperor has received
little Satisfaction from the
Diet of the Empire at
Frankfort. Every Prince and
Circle have some Grievance
to complain of, of which the
Redress is expected before
any Aid is granted to his
Majesty. It is particularly
required by them, that their
Territories be freed from the
French Troops, and that the
Inhabitants be indemnified
from the Damage which they
have sustain'd by them.
The French have resolved to
raise 50000 Militia, of which
Part is to assist the Count de
Glimes, Commander of the
Spanish Troops in Provence,
who have received express
Orders to penetrate tho'
Piemont into Italy.
The Citaded of Moderna
having surrendered, and the
Garrison of 3000 Men made
Prisoners on the 14th past,
will with the City belong
henceforth to the King of
Sardinia; and Mirandola
which surrendered the 11th
Instant, to the Queen of
Hungary.
The Conclusion in our next.",russian unrest/conspiracy,"October 18, 1742",nonslave
The South Carolina Gazette,NA,Elizabeth Timothy,1742_10_25,"October 25, 1742",1742,"July 22. Some private Letters
from Paris speak of
dangerous Insurrection in the
Sevennes, and that the Duke
de Richelieu was sent to quell
it",dangers of insurrection in France,"October 25, 1742",nonslave
The South Carolina Gazette,NA,Elizabeth Timothy,1742_11_01,"November  1, 1742",1742,"Yesterday came Advice that a
Swedish Officer, who was
going to execute a
Commission at the Court of
France, was seiz'd at
Dantzick, with all his Papers,
some of which, it's said, relate
to the Conspiracy in Russia",conspiracy in russia,"November  1, 1742",nonslave
The South Carolina Gazette,NA,Elizabeth Timothy,1743_05_02,"May  2, 1743",1743,"From Corsica, That a Genose
Major having exacted the Taxes
by Fire and Sword, was put To
Flight, and a general
Insurrection was apprehended.",Corsica insurrection; does use passive voice,"May  2, 1743",nonslave
The South Carolina Gazette,NA,Elizabeth Timothy,1743_05_23,"May 23, 1743",1743,"To this Letter they add a
List of their Forces, as
follows.
This early Submission, even
before a Summons could be
sent, appears highly
satisfactory to this Court, as it
may send to preserve Peace on
that Side
General Teracanow writes, that
Satisfaction having been given
to Sarah Thamas by
Imprisoning our Commandant
at [ ] , for assisting some
rebellious Persians, that Prince
has withdrawn his Army to
Derbent  The Peterbourg
Gazette adds, that this Prince
knows his Strength too well to
measure it with that of Russia.","describes ""rebellious persians""","May 23, 1743",nonslave
The South Carolina Gazette,NA,Elizabeth Timothy,1743_07_04,"July  4, 1743",1743,"The Utrecht Gazette gives us
the following curious Piece,
and
an Answer to it.
Memorial presented to his
Britannick Majesty, by M. [ ]
The Genoese minister in
London.
SIRE,
THE Sentiments with which
my Republick has all along
endeavourd to preserve a
solid Correspondence with
the Crown of Great Britain,
and studied always to deserve
the Goodwill of your Majesty
and the Kings your
Predecessors, are well known
to your Majesty, your
Ministers, and the whole
British Nation; upon all
Occasions my Republick has
had the Happiness to be
inform'd, by her Envoys and
Ministers at your Court, of
your Kindness to her, and
that her Behaviour towards
you was agreeable to your
Majesty.
The Emperor Charles the 6th,
Father to her Majesty the
Queen of Hungary, did grant
auxiliary Troops to the
Republick, in order to reduce
the Kingdom of Corsica to the
Obedience of its lawful
Sovereigns; but after the
Departure of these Troops,
the Rebellion having broke
out again, his most Christian
Majesty was pleased to offer
to bring back the Corsicans to
their Duty and restore the
Tranquility of the Island.
The Republick
communicated that Treaty to
your Majesty, and beseech'd
you to enter into
Engagements so just, by
granting her the Guaranty to
Corsica, in the Same [ ] as
had been done in Concert by
the late Emperor and his
most Christian Majesty.
Tho' your Majesty did not
think fit at that Juncture to
secure to that Treaty, yet you
were to good as to make
Answer to the Republick's
Minister, that you were
pleased with is Mark of her
Regard and Attention; that
you look's upon the Succours
offer'd by Frances as the best
and only Means to put an
End to the Rebellion; that the
Republick might be assured
of your Majesty's favourable
Intentions, who had given her
Proof thereof before any
other Prince did, in expressly
forbidding all Officers of
Ships under English Colours
to transport to Corsica Arms
& warlike Stores, or to hold
any Manner of
Correspondence with the
Rebels.
After such signal Proofs of
your Majesty's Regard for
the Republick, and there
Recent Assurances thereof
which she has received on
Account of what was lately
done by Vice-Admiral
Mathew's Squadron we have
Advices from divers Pars that
Theodore de Neuhoff, known
in the World to be the Author
of the Troubles in Corsica,
was in the British Seas, and
intended to set sail for the
Mediterranean. We have
since learn'd that he appear'd
on the Coast of Portugal on
board an English Man of War
commanded by Capitan
George Barclay; and that it
was currently reported at
Lizbon, that he was going to
Corsica with Arms and
Ammunition.
Afterwards we had Advice
that he touch'd at Villa-
Franca, in the said Ship, and
at last, that he put into
Leghorn, about the Middle of
February: That he receiv'd
there on board his Ship
several of the Principal of the
[ ] and seditious Chiefs of the
Corsicans, who had been
dispers'd in several Towns in
Tuscany: That he had a
private Conference of several
Hours with General
Breitewitz, who came from
Florence to Leghorn, and
went on board the English
Ship in Company with the
British Consul. In fine, we
heard that the said Theodore
departed from there with
those Chiefs of the Rebels, all
embark'd in the same Ship, in
the Night of the 30th of last
January, steering towards
Corsica, in Company with
another English Man of War
called the Salisbury,
commanded by Capt. Peter
Osborn That a few Days
before, the said Theodore had
dispatch'd an [ ] to Corsica,
one Vincess by Name, in
another English Man of War,
and had caused a seditious
Edict to be dispatch'd, dated
the 7th Year of his Reign; in
which Edict he discovers his
Views and Intentions against
the Tranquility of Corsica,
even in Expressions so
unguarded as the Powers of
Europe might justly be
offended at.
The Republick has received
further Intelligence from her
Commissary General and
Commandants of the Towns
in Corsica, viz. That the
above mentioned Emissary of
Theodore had landed in the
Island; that he was spiriting
up the People to a new
Rebellion; that he promis'd
them the Arrival of Theodore,
with several English Men of
War, Land Forces, and a
great Quantity of Arms and
Ammunition. The said
Commissary General and
Commandants also write,
that the Revenge and the
Sainbury had appear'd on the
Coast of Corsica, and landed
Gun powder and other
warlike Stores at a Place
call'd Isola Ressa; that these
Ships cruized in that Sea in
order to intercept, as 'tis said,
the Succours that might be
sent from Genoa, to the
Places in the Island; and that
in the mean Time they
actually stopped, with their
Long Beats, all the casting
small Craft under Gencese
Colours, taking out their
Cargoes, and detaining the
Sailors on board their Vessels
some Time; that Theodore,
being still in the Revenge, had
summoned the commanding
Officers, of some little Forts,
to surrender, otherwise, they
should be treated with the
utmost Severity of War.
The Republick being
persuaded of your Majesty's
magnanimous Sentiments,
and of the Wisdom of your
Ministry, who are a Pattern
to other Nations in regard to
Equity and Justice, the most
constant Maxim of which has
always been, That all Princes
be maintain'd in their Rights
and Dominions; the
Republick, I say, cannot
express the Surprize and
Confusion which so positive
and circumstances Accounts
have caused her: She cannot
form any Conjecture well
enough grouded about the
Cause of so unforeseen an
Event. She cannot imagine
that the Commanders and
Captains of the English Ships
can, in their own Names, and
thro' selfish Views, be guilty
of such Attempts. Besides she
is very well assured, that if
false Reports could have
prejudicted your Majesty,
you would not have fail'd to
communicate your
Sentiments to the Republick's
Minster, [ ] the End that she
might justify herself in a
proper Manner, until your
Majesty was thoroughly
satisfied.
I am charg'd, by Orders of
my Republick, which have
been dispatch'd to me by an
Express, to represent most
humbly to your Majesty all
the above Things, and at the
same Time to beseech you to
cause the necessary Ecclair-
cisements to be given to the
Republick, to the End that in
her Anxiety, as well as in the
Steps she may take, she may
Behave so as to deserve the
just Approbation of the
British Crown.
The Duke of N-le has
declared to Mr. [ ], Minister
form the Republick of Genoa,
that the King was no Way
privy to the Schemes of
Baron Neuhoff; That if the
Baron boasted of the
Protection of England, it was
upon very ill Grounds, and
probably, to procure himself
more Credit among the
Corsicans; That as to the
Rest, it was not in one of his
Majesty's Ships that he sailed
to Lizbon, in his Way to
Corsica, and therefore it must
be a Merchant Man that
carried him thither; that the
King would not be concerned
in any Thing relating to
Baron Neuhoff, and that his
Majesty was every ready to
give the Republick Proofs of
his Friendship",on rebels in corsica/genoa,"July  4, 1743",nonslave
The South Carolina Gazette,NA,Elizabeth Timothy,1743_10_17,"October 17, 1743",1743,"BARON Gustavus
William d'Imhoff,
Governor-General of the
Dutch Settlements in the
East Indies, sailed from
hence on the 28th of
February last, for [ ],
from whence there
arrived two Ships, as
usual, to meet him.
By these Vessels we learn a
good deal of News [ ] to the
Island of Java It seems that
the Chinese after the Revolt,
of which we have long ago
had an Account, declared
openly for the Emperor of
Java, with whom they and
before privately concerted the
surprizing of the Fortress of
Batavia, and massacring all
the Europeans. The two
Princes, Sons of the Emperor,
who were then in the Castle,
in order to be brought up
after the manner of the
Dutch, and disclosed this
infamous Design, and thereby
prevented [ ] taking Effect;
for which the Emperor their
Father, [ ] them afterwards to
be put to Death.
Notwithstanding this
Discovery, the Rebels became
afterwards [ ] of that
Fortress, and then marched
with their whole Forces,
consisting of no less then two
hundred thousand Men, and
advanced towards the
Fortress of Samarang, the
last Refuge of the Dutch,
under the Cannon of which
by uncamp'd about twelve
thousand Men They
dissembled the Resolution of
Fighting 'till the Enemy were
so far advanced as to be
flank'd by all the Cannon of
the Place; and on the
Discharge of which, the
Troops in Dutch Pay attacked
them with the utmost
Resolution. They were twice
repulsed with considerable
Loss, and the [ ] thought
them the last time so far
broken, that they pushed
them home to the Walls, and
thereby exposed themselves
to a second Salvo from the
Fort, which did such
prodigious Execution, that
when the Dutch Army
attacked them the third Time,
they presently broke and fled,
leaving behind them 200
Pieces of Cannon, 30
Mortars, and an immense
Quantity of Ammunition.
Since that Time both the
Chinese and Javans have
been very quite. And the
Dutch [ ] the Advantage of
their Weakness, have
effectually. . . themselves in
their Posts, and the
Tranquility of Bavaria was
absolutely re establish'd,
before the Arrival of the
following Ships from
Holland, viz The [ ],
Beukestein, Nieuw,
Walcheten, Goodschalkcort,
Watervliet, Polanen,
Everlwaerd, and Scheybeek
this [ ] first on Account of the
Chamber of Amsterdam, the [
] on Account of Enckhuysen,
the Sixth of that of from
These sailed from the Texel
on the 3d of May, [ ] and the
three others left Zealand
about ten Days after",mentions rebels,"October 17, 1743",nonslave
The South Carolina Gazette,NA,Elizabeth Timothy,1743_12_12,"December 12, 1743",1743,"Extract of a Letter from
Paris, Aug. 19.
We have private Intelligence
here, that Spain has offer'd
Great-Britain, (1st) Fort St.
Augustine and a free Trade;
and (2dly) to enter into the
Confederacy, in order to
compel France to give up
Lorrain, that Don Philip may
have Tuscany. It is incredible
what Consternation this
News has thrown People into
here: Some on the other
Hand do alledge, these Plans
are thrown out on purpose to
quiet the Nation, and dispose
them to the new Schemes
which Cardinal Tencin
intends a shortly to break to
his Pupil, and the few Persons
he suffers to be admitted to
those Conferences, which are
observed to be held previous
to all Councils of State. We
talk of nothing now but Plots,
Conspiracies and
Insurrections, which is
imputed to this new Minister,
who would be glad by some
Acts of Severtiy to fix his
Power","talk of conspiracies, insurrections and plots (groups together these terms)","December 12, 1743",nonslave
