newspaper,newspaper_ID_histCommons,printer,date,written_date,year,text,notes,written_date,resistance_tag
The South Carolina Gazette,NA,Peter Timothy,1766_06_02,"June  2, 1766",1766,"To the Printer of the
South-Carolina
GAZETTE.
Dicere verum quid vetat.
AT a time when the hearts of
the people are intoxicated with
joy, for our happy deliverance
from the apprehensions of
oppression and slavery, it may
be supposed a little
extraordinary any steps should
be taken, which might seem to
have a tendency to destroy that
harmony, which ought to, and
which we hope will, subsist
among the different people who
make up our little society.
However illiberal it might be,
to reflect upon any particular
set of men, on account of birth
or country, which are matters of
no consequence; for, in this
respect a Hotteniot, with all his
filth about him, is upon a
footing with the proudest
nation in the universe; yet
resentment becomes every
honest breast for it juries
received; nor is it possible to
conceive, how a proper regard
can be paid to virtue, unless we
feel the warmest indignation
for those dirty prejudices we
daily see in life, and which tend
to stigmatize the characters of
the innocent.Pudei hcop
probria nobis.
If a number of men from any
part of the globe to whom
fortune hath not been
remarkably lavish of her
favours, whom hath not made
superior to the rest of creatures,
in the abilities of heat or should
they, like the wandering Jews
seek a land flowing with milk
and honey, whoever it is to be
found, and, like the Jews,
harbour the greatest contempt
for the simple inhabitations
who possess it; should they be
too proud to admit of any
equality with themselves, yet
humble enough, when interest
directs, to mingle with men
whom they affect to despise; if
their reflections are cruel and
unjust, to a people who have
hitherto treated them with
civility, and received them as
fellow-subject; if their whole
conduct in life is suspicious,
partial and can they be
surprised, if we should at
length see through them, and
view them in that light in which
they have viewed others, and
receive to deal with them only
just as they have dealt with
others? Does not common
sense, common justice, and
even our common safety, press
such a return as absolutely
necessary?
When the different colonies
had taken the constitutional
method of seeking redress of
the injuries they were about to
receive from the Stamp-Act;
when their petitions were
rejected, and the act was upon
the point of being executed; the
people, who had trusted to their
representatives while there was
a possibility of their being of
service, then took the alarm;
were enraged at a treatment
they never deserved; and,
terrified at the prospect of
future slavery, prevented the
officers from enforcing the act.
This was termed
RESOLUTION. This
appellation was given to it, by
a sett of men who certainly
ought to know what rebellion
is, far better than any other of
his Majesty's subjects: They
have been guilty of the crime;
they have felt the chastisement
it deserves. Some old stagers
compared the congress to the
meeting of the Clous in 15 and
45: Take the PRINCIPLES of
each, and judge if the
comparison is just.
The SCOTCH had been
amongst the most violence in
the expulsion of the Stuarts;
they rejoiced at the revolution;
they were incorporated in
Queen Anne's reign, and were
content (God bless them) to
become Englishmen: On a
sudden, they took up arms to
dethrone Majesty, to place the
crown on the supposed
offspring of that family they
had rejected; endeavoured to
overturn the constitution, to
establish a government
destructive of the natural rights
of man and of that government,
ditch is a disgrace to the deity.
This was Resolution indeed? a
Rebellion against God and
man!
The AMERICANS brought
charities, granted by royalty
itself, along with them, in
whatever colony they settle; the
common law attended them;
right of Englishmen were
expressed in their chatters; they
confidence themselves, and
were considered, as entitled to
such rights; they have for a
century enjoyed them, without
interruption: Their loyalty has
been as unshaken as the guards
of his Majesty's most sacred
person; the same lips which in
peace the authors of their
wrongs, spoke with reverence
of Him.
At length a bill, through many
whimsical events, had found its
way through both houses, and
was passed into a law: A bill
which deprived them of the
protection of law, and totally
destroyed these lights which
distinguishes them from the
slaves they command. The
nearest freeholders knew, they
were represented in their own
colonies, by those whom
themselves had effected; not
could they have least
conception of any other
representation: They knew it
was the birthright of
Englishmen; it was their
birthright; it was their best,
their only, security. Many
among them had a more
extensive idea of the
constitution; they knew it was
not in their power to yield up
the rights, which their children
were equally entitled to: They
knew, they could not forfeit
them without committing
certain crimes; they had
committed none; no crimes
were laid to their charge; they
know, in every free
constitution, let the form of
government be what it would,
resistance was sometimes laun
They knew the revolution was
brought about the principles of
resistance; that it could be just
fled from no other principles;
and to these principle they were
indebted for the present royal
They bought resistance in them
was a virtue, because the two
blessings, for the sole
protection of which men enter
into society, their liberty and
their property, were at stake:
They knew the power of them
mother country; and had she
her force, their ruin would have
been inevitable; but through the
honest impressions of
education, and notions derived
from old story-books, whipt
into them when they were boys
perhaps, they thought it more
generous to perish, in that ruin,
than to have lived to see their
offspring subject to the daring
insults of every son of Mars, or
to behold their country reduced
to that desart which their
fathers found it. The SCOTCH
endeavoured to introduce a
despotio government in church
and state. We, like the Barons
of old; cried out, ""Nolumas
leges Angl mutari:"" If this be
REBELLION, we are slaves
indeed.
As to the irregularities of the
people, they were to be
lamented; but he who implicitly
condemns, known as little of
man as of government. The
multitude never leave their
occupations to turn politicians,
but when they feel oppression:
Actuated by those passions
which nature has given them,
directed solely by what they
suffer, they will fly from one
extreme to the other, and be
violent in their friendships, or
implacable in their resentment:
And if they were sometimes
hurried too for, let it be
remembered, their anger was
perpetually fed by the idlest
reports; and others, through the
meanest of passions, (their
avarice) were undermining
their worthy intentions, by
every invention that could be
thought of. The torrent could
not have been stopt, but it
might have been diverted, so as
to prove altogether harmless. If
those who were more interested
as they had more to lose, had
mingled with the croud, and
assisted them with their advice,
the people might have been
brought to submit to any thing,
but admitting the act.
I know not for what reason, but
the minds of the freeholders
were inflamed at the last
election, by many a hearty
damn to be ove bottles, bowls
and glasses: A violent
opposition succeeded; and the
richer folks were terrified at a
spirit which themselves had
conjured up; but instead of
endeavouring to reduce the
they had kindled, like the
sluggish tortoise, they shrunk
within their own shells at every
supposed danger. If adversity
drags out EVERY lurking
virtue from the breast (good
God!) what a country do we
live in.
However, we ALL meant, it
now seems, equally well,
though we did not mean to run
the same risk; and when the
news of our deliverance from
impending bondage arrived, we
ALL rejoiced. Of all God's
creatures, Man is the most
inaccountable; his ways are
unsearchable for wisdom, and
there is no finding out his
understanding. They who had
accused us of Rebellion
rejoiced most (outwardly I
mean); like good Christians
they let their light. SO shine
before men, that they might
SEE thing works: They stuck
up tallow in their windows, and
shewed their zeal for Liberty at
the expence of a few farthing
candles. Strange! That they
should light their houses for the
success of REBELLION! and
that a second night too, which
we all now know was entirely
occasioned by them.
Happy, thrice happy race of
men? whose frames are so
peculiarly adapted to the
different circumstances of life,
that, let whatever side prevail,
you can lift up your hands and
join your joyful voices. Had
America bled at every pore, for
crimes she never committed,
for crimes which all her sons
abhor, you might have stood
aloof and enjoyed your posts.
Had her towns been fired, like
another Nero, you might have
played on your instruments,
and sung Te Deum at the
conflagration. But when one
good, one great, one wise man's
influence had saved us from
impending ruin, like to
converted Paul, when the scales
were dropt from his eyes, the
truth beamed forth in all her
native beauty, and persecution
becomes abominable.
I shall take my leave with a
well known story. Archbishop
Sharp had been a staunch whig
in the earlier part of his life,
and when it suited; became a
story in the reign of Queen
Anne: At length he found they
intended to introduce the
PRETENDER, and he trembled
for his dignities in the church;
away he goes, commissioned
by his brethern the good
bishops, to the Earl of
Wharton, who headed the
whigs, and informed his
lordship, he was very sorry
they had so long been of
different sides, altho' he was
sure they had the same
meaning in what they did; that
the had found out the wicked
intentions of the tories, and was
not come to offer him the
service of the lords spiritual.
His lordship replied, he was
very glad to find they were
convinced of their error; but
before he would enter into any
business, begged leave to
mention a little domestick
affair that had just happened:
My Lord, I am an old
sportsman; I love does, and am
very careful in breeding them;
the other day I had a litter from
the breed of my old master
King William, whom you know,
I admired in the choice of all
his, creatures; I waited the
usual time, in expectation of
their opening their eyes, and it
was a matter of amazement
they continued so long blind, as
they had a good dam and an
excellent fuckler; thus
disappointed day after day, and
week after week, I grew angry,
and ordered the huntsman to
throw them into the river; and
what do you think, my lord!
when the puppies were
drowning, they all their eyes.",important editorial piece in reaction to the stamp act,"June  2, 1766",nonslave
The South Carolina Gazette,NA,Peter Timothy,1766_06_20,"June 20, 1766",1766,"London, March 14. Letters
from St. Kitt's mention that the
French inhabitants of Old Cape
St. Lewis at Hispaniola had
made a second insurrection,
more dangerous than the first,
and that a detachement from
Martinico was upon the point
of setting out in order to quell
them",,"June 20, 1766",nonslave
The Virginia Gazette,1,Alexander Purdie and John Dixon,1767_01_01,"January  1, 1767",1767,"PHILADELPHIA, Dec. 11.
Extract of a letter from London,
Sept. 30.
""I happened to be at York
during the races there, where a
prodigious concourse of Gentry
was assembled, and where the
Marquis of Rockingham was
presented with very warm
addresses from most of the
trading towns of that extensive
country, highly extolling his
late patriotick administration,
and deeply regretting their
being now deprived of his
further assistance; and indeed
the late Ministry seem to stand
very high in the publick
esteem, in general. How this
will operate next winter, I will
not pretend to say.
""At present people seem to be
somewhat tired of the abuse
that hath for some time been
thrown out against Lord
Chatham, and wait with
impatience to see what conduct
he adopts at the opening of the
session; he is now really very
ill of the gout, and is at present
at bath, in order to recruit his
health. In the mean while there
is nothing but riots and
insurrections over the whole
country, on account of the high
price of provisions, in
particular corn. The Privy
Council have put a stop to the
exportation of it in the interim,
but some means must be fallen
upon to lower the price of the
necessaries of life in general, or
I know not what will become of
the labouring poor.""
December 18. One day last
week two fellows had the
boldness to go into his Honour
the Governor's house, at noon,
one of whom went into the
pantry for plunder, while the
other stood watch in the entry;
but some of the servants he ring
a noise, seized the fellow in the
entry, and the house being
alarmed, the other fellow was
also taken, who had carried off
a pair of silver candlesticks.
On Monday, the 8th instant,
was killed by James Mather, in
Chester, a cow, the four
quarters of which weighed
seven hundred and fifty six
pounds, tallow one hundred
and six pounds, hide sixty
seven pounds. In all, eight
hundred and ninety three
pounds.",,"January  1, 1767",nonslave
The South Carolina Gazette,NA,Peter Timothy,1767_01_05,"January  5, 1767",1767,"By letters from Africa, via
Dominica, we learn that the
soldiers at James's fort, on that
coast, had formed a design
August last of seizing the fort,
and murdering the officers, and
other residents there; but the
horrible conspiracy was
discovered by a soldier to the
commanding officer, the night
before it was to have been put
into execution, who
immediately put the ringleaders
into irons, and sent them by
commodore O'Hara to Senegal,
to take their trials",conspiracy on African coast at a fort of soldiers,"January  5, 1767",nonslave
The Virginia Gazette,1,Alexander Purdie and John Dixon,1767_01_15,"January 15, 1767",1767,"The same day the heads of 40
of the rebels from the island of
Cyprus were exposed at the
gate of the Seraglio. Chour
Achmet, Bashaw of Two Tails,
who was sent to quell the
rebellion in that island, has
received a third, tail, as a
reward for his services on that
occasion. LONDON, October 15.
Letters from Constantinople, by
the way of Leghorn, advise that
the Porte were no longer under
any apprehensions from the
Georgian rebels, having
received undoubted intelligence
that Prince Heraclius had
retired to the defiles of his own
country, on the approach of a
numerous body of Turkish
troops. ",cyprus,"January 15, 1767",nonslave
The Virginia Gazette,1,Alexander Purdie and John Dixon,1767_04_30,"April 30, 1767",1767,"Jan. 15. The titular Duke of
Melford, who lately died in
France, was Lord Lewis
Drummond grandson of the
Earl of Melford, a Scots Peer,
attainted at the revolution, who
was afterwards created abroad
a Duke by King James the 2d.
Lord Lewis landed at Peterhead
in 1745 with about 200 men, in
support of the young Pretender,
and continued in the rebellion
until after the battle of
Culloden. On the death of Lord
John Drummond he got the
regiment commanded by him in
the French service, called the
Royal Scots, which he kept
until disembodied. He was
reckoned one of the tallest and
handsomest men of the age. Of
the Scots Nobility engaged in
the rebellion there are now only
four alive in France, or
elsewhere, viz. Lord Ogrlvie,
Lord Elcho, Lord Nairn, and
Lord M'Lood.",,"April 30, 1767",nonslave
The Virginia Gazette,1,Alexander Purdie and John Dixon,1767_05_07,"May  7, 1767",1767,"""The address of the New York
Assembly to their Governour
has made a great noise and
disturbance throughout this
kingdom, in all companies and
conversations; insomuch that it
is generally said they are in a
state of rebellion, and are
endeavouring to throw off their
dependence, &c. I hear the
Ministry are in great and deep
concern about it. Most people
are of opinion they will
certainly enforce the execution
of the act of Parliament, and to
that end will send over troops,
ships, &c. the consequences of
which I most sincerely dread in
every light in which they can
be viewed, either as an
infringement of the liberties of
the people, or, in the case of
resistance, for the miseries such
a conduct must necessarily be
productive of. It is said the
Ministry wait the arrival of
Lord Chatham from Bath,
where he has been long
detained by the gout, in order
to take a final resolution with
regard to this matter, and to
concert measures for the
execution. God's grant they
may be favourable to the
colonies. Our province, I
should tell you, has acquired
reputation with the Ministry for
their behaviour upon this
occasion, and I hope they will
continue to deserve it upon all
future ones, that do not so
immediately strike at
fundamentals, as the Stamp Act
did; and yet so infatuated are
the people here as to make no
distinction between one colony
and another, but to involve the
whole continent in the
miscarriage of one very small
part of it.""",,"May  7, 1767",nonslave
The South Carolina Gazette,NA,Peter Timothy,1767_05_11,"May 11, 1767",1767,"We are also encouraged to
express our earnest hopes and
confidence, that by the
continuance of their assistance,
and by the wisdom and justice
of a truly British parliament,
the strict may be enforced; and
that his Majesty's loyal and
obedient subjects, the
landholders of that kingdom,
will not be charged with an
increase of taxes, unknown in
time of peace, in order to
defray the expences, which
have hitherto been constantly
borne by his Majesty's colonies
in America; and of which those
colonies have, by insurrection
and violence, refused to
contribute any part for their
own protection and defence,
though required thereto by an
act of the British legislature",,"May 11, 1767",nonslave
The Virginia Gazette,1,Alexander Purdie and John Dixon,1767_07_02,"July  2, 1767",1767,"LONDON, March 28.
A VERY cutting memorial has
this week been despatched to
the Senate and Republick of
Genoa, on the article of that
nation's so liberally building
ships of war for the service of
France.
The Dutch, if the information
Mr. Botteler, their
Ambassadour, gave to the
Marquis of Rockingham, be
true, have nearly 50,000,000 l.
slerling in our funds, the annual
interest of this sum cannot be
much less than 2,000,000l. Our
East India Company, supposing
they fit out no more than
twenty ships yearly, and that
each ship, upon an average,
exports forty thousand pounds
in coined money and bullion,
must necessarily carry out of
this kingdom 800,000l.
annually not is this estimate
exaggerated, as plainly appears
by the exports of that Company
last year, which amounted in
gold to forty three thousand
one hundred and ninety six
pounds sterling, and in silver to
seven hundred eighty five
thousand two hundred and
three pounds. These two
exorbitant drains of cash,
investigated through their
various operations, will be
found to be the efficient causes
of the exorbitant price with
every species of provisions
bears at present, and which, if
not remedied, may, in time,
produce a general insurrection
of the people",,"July  2, 1767",nonslave
The Virginia Gazette,1,Alexander Purdie and John Dixon,1767_07_30,"July 30, 1767",1767,"Letters from Madrid import
that besides the great treasure
in the possession of the two
Jesuits of Paraguay who were
lately arrested at Figuera, on
their way to Rome, some
papers were likewise found
upon them containing literal
proof of the conspiracies at
Quito, Lima, and Mexico; and
which, it was thought, had
contributed to accelerate the
ruin of that Society in the
Spanish monarchy.",,"July 30, 1767",nonslave
The Virginia Gazette,1,Alexander Purdie and John Dixon,1768_01_07,"January  7, 1768",1768,"BOSTON, December 14.
To the PRINTERS.
HOWEVER little some may
think of common newspapers,
to a wise man they appear the
Ark of God for the safety of the
people. Their fullness of
general entertainment, small
bulk, and price, recommend
them to every one; and the
variety of the matters, with the
great importance of many of
them, awaken the minds of
many to a solid inquiry of
interests they would otherwise
never once dream of. Never
was a time when greater ence
was necessary to render these
batteries respectable: Press,
and the maintainers of its
freedom, are be obnoxious to
the Gentlemen of High Fortune,
measure will be left untried to
crush the seditious disturbers
of the publick tranquillity;
rebellion, treason, heresy, and
pretence, if there is but power.
There are but two methods of
government, leading and
driving: Nothing will lead the
people but a conviction that
their safety and interests are
the concern of their rulers; and
when the arguments used on
the side of power sail to evince
these points, then may we
expect to hear of racks and
gibbets, and inquisitions in
plenty, and the most worthy
members of the community
deprived of their places of
power to guard the rights of the
people. Assemblies, and right
of trial by juries, must be
undermined by degrees, but
hastened as much as possible,
left a new Administration
should be forced in by a
desperate people, before things
can be thoroughly established.
A man must be slow of
understanding, indeed, to be at
any loss for the tendency of
present measures. Dominica is
taxed by Prerogative alone,
without pretence of Parliament;
and what is the difference in the
condition of the whole
continent, besides the pretence?
Touch not, taste not, handle
not, left destruction come upon
you suddenly, and there be
none to deliver!
PROVIDUS",editorial to the printers at Boston,"January  7, 1768",nonslave
The Virginia Gazette,1,Alexander Purdie and John Dixon,1768_01_28,"January 28, 1768",1768,"If any person cannot conceive
the supremacy of Great Britain
to exist, without the power of
laying taxes to levy money
upon us, the history of the
colonies and of Great Britain
since their settlement will
prove the contrary. He will
there find the amazing
advantages arising to her from
them, the constant exercise of
her supremacy, and their filial
submission to it, without a
single rebellion, or even the
thought of one, from their first
emigration to this moment; and
all these things have happened,
without an instance of Great
Britain laying taxes to levy
money upon them. ""Our colonies, while they have
English blood in their veins
and have relations in England,
and WHILE THEY CAN GET
BY TRADING WITH US, the
stronger and greater they grow
the more this Crown and
kingdom will get by them; and
nothing but such an arbitrary
power as shall make them
desperate can bring them to
rebel.""",,"January 28, 1768",nonslave
The South Carolina Gazette,NA,Peter Timothy,1768_02_01,"February  1, 1768",1768,"Some advices received at
Leghorn from Constantinople,
mention, that the malcontents
of Georgia, had lately broke out
in a fresh rebellion against the
Grand Slgnior. ",,"February  1, 1768",nonslave
