newspaper,newspaper_ID_histCommons,printer,date,written_date,year,text,notes,written_date,resistance_tag
The Virginia Gazette,1,William Hunter,1751_01_31,"January 31, 1751",1751,"Parma, Sept. 21. Last
Wednesday we had a little
Insurrection or Tumult here,
which might have been
attended with sad
Consequences, if the
Government had not quell'd it
before it got to a Head. The
Occasion of it was thus; One of
the Infanta's Maids of Honour
wanting a larger Apartment, the
Steward of their Royal
Highnesses Houshold allotted
her the Office of the Ducal
Chancery; and accordingly a
Number of Porters were set to
work, to removed every Thing
out of that Office to another
Part of the Palace: But as the
Archieves of the Country were
kept in that Office, and as the
People look upon them as
sacred Things, which ought
never to be removed out of
their Palace, a great Crowd
soon gather'd about the Porters,
and without any farther Inquiry
were beginning to handle them
very roughly, when the
Magistrates interposed, and
appeased the Tumult. However,
the Populace are not yet quite
satisfied that the Court does not
intend to run away with the
Archieves",,"January 31, 1751",nonslave
The Virginia Gazette,1,William Hunter,1751_02_07,"February  7, 1751",1751,"When the Reader reflects on
the different Dispositions of the
same Estates made by all these
Deeds and Wills, he will be
able to judge, whether they are
not the Productions of a Man
contriving such Schemes as
would be most beneficial for
his Patrons, rather than the Acts
of one depressed by Age, and
in Expectation of an
approaching Dissolution.
In short, so intricate were the
several Causes of Dispute, and
carried to so great a Length,
that the Hearing took up seven
Days before the Lord High
Chancellor; but by his great
Assiduity and Sagacity, he
became so well acquainted with
the Merits, that on Aug. 5,
1748, he pronounced that a
Trial should be had in the
King's Bench, by a special Jury
of Gentlemen of Herefordshire,
on the Validity of the Will of
Oct. 1736, and the Writings of
June 18 and 19, on which a
Verdict having passed,
grounded on Forgery, his
Lordship on July 18, 1749,
made a Decree, by which the
Heir had Possession of his
Father's Estates, and the
Opposers were to pay Costs.
An authentick Account of all
the Proceedings is published by
W. Sandby in Fleet-street,
London, in which it is
observed, ""That when the
Friends of the Lunatic first
undertook his Defence, they
had all imaginable
Discouragements; they were to
engage with an artful Set of
Men, who had been intrenching
themselves, for many Years, in
deep Plots and Contrivances,
and were all bound by their
Interest, and the Danger which
hung over their Heads, to an
inviolable Secrecy; so that for
some Time few Discoveries
could be made: At length many
Circumstances appeared in
their Favour; the Intricacy of
the Case raised the Attention,
and the Distresses of the
Lunatick, moved the Humanity
of the Court; Gentlemen of the
highest Eminence in the
Profession of the Law stood up
in his Defence, who all exerted
their utmost Abilities in his
Favour, with a very uncommon
Zeal, Generosity and
Application: And his Cause
was at last submitted to the
Decision of a Judge, too
discerning to be imposed upon
by the most complicated Fraud.",plotting,"February  7, 1751",nonslave
The Virginia Gazette,1,William Hunter,1751_02_21,"February 21, 1751",1751,"Upon the Accession of the late
King, his Grace was restored to
several of his Posts, and was
made Commander in Chief of
the Force in Scotland;
consequently, when the
Rebellion broke out in 1715, he
was ordered to repair to
Scotland, to take upon him the
Command of the King's Forces
there: But as he happened at
that Time to be no great
Favourite at Court, he was left
for a long Time with not much
above 2000 regular Troops, to
make Head against the Rebels,
who had got together an Army
of near 10,000 Men. However,
he defended the Pass at
Stirling, and prevented the
March of the main Body
Southward, 'til Nov. 13. when
having received a
Reinforcement of two
Regiments of Foot, and a
Regiment of Dragoons from
Ireland, he marched out and
met the Rebels that Day at
Dumblain, where a Battle
ensued with various Success,
but had such a happy Effect as
to force the Rebels to retire
back again to Perth; so that in
its Consequences it was little
short of a compleat Victory, and
may be said to have put an End
to the Rebellion.",,"February 21, 1751",nonslave
The Virginia Gazette,1,William Hunter,1751_03_21,"March 21, 1751",1751,"Dec. 21. The Wardens and
Court of Assistants of
Fishmongers, went in
Procession, from their Hall in
Thames-Street, to Leicester-
House; to present his Royal
Highness the Prince of Wales,
with the Freedom of their
Company. The prime Warden,
presented his Royal Highness
(who was seated, and
surrounded by the young
Princes, and the Lords of his
Court) with his Freedom in a
Gold Box of exquisite
Workmanship. At the same
Time Mr. Tomkyns, Clerk of
the Company, addres'd his
Royal Highness in the
following Speech; [They all
had the Honour of kissing the
Prince's Hand; and after being
entertain'd, by his Royal
Highness's Desire, they return'd
back in the same Order they
came.]
May it please your Royal
Highness,
THE Warden and Commonalty
of the Mystery of Fishmongers
of the City of London, beg
Leave to return their unfeigned
Thanks for this additional
Honour of being permitted to
wait your Royal Highness with
your Freedom of their
Company.
This worshipful Company, Sir,
is fourth in Precedency of the
several Companies of the City
of London. But, Sir, inferior to
none in Zeal and Affection to
his Majesty, your Royal
Highness, the Princess, and the
whole Royal Family.
The Fishmongers were
incorporated so long ago as in
the Reign of King Richard II.
and their Charter has been
renewed and confirmed in
several Reigns since that Time.
This Company, Sir, are famous
for having had near 60 Lords
Mayors of the City of London,
besides many of the most
considerable Merchants and
eminent Citizens, free of it; one
of which, Sir William
Walworth, is recorded in
History for his Bravery, in the
4th Year of Richard II. when he
was the second Time Lord
Mayor of London, for
destroying with his own Hand,
that notorious Rebel Watt Tyler,
then at the Head of 30,000
Rebels, and thereby putting and
End to a very dangerous
Rebellion, of which he was the
Promoter and Ringleader.
But, Sir, these are Honours no
longer to be boasted of, when
such infinitely greater are
conferred by your Royal
Highness, in condescending to
accept of the Freedom of the
Company.
To which his Royal Highness
was pleased to make the
following most
gracious Answer.
Gentlemen,
ALL Marks of Regard that
come from any Branch of the
City of London are very
agreeable to me; and your
Company will always find me a
sincere and hearty Friend",,"March 21, 1751",nonslave
The South Carolina Gazette,NA,Peter Timothy,1751_05_20,"May 20, 1751",1751,"LONDON, January 29.
Yesterday the Right Hon. John
Lord St. John of Bletsoe took
the oaths and his seat in the
house of peers.
As did also the Right Rev. lord
bishop of Bristol.
The next heirs to the lord
Forbes of Pitsligo, who was
concerned in the late rebellion,
are applying to parliament for a
confirmation of a decree of the
lords of session in Scotland,
which was in their favour, in
order to recover to that family
the forfeited estate.",,"May 20, 1751",nonslave
The Virginia Gazette,1,William Hunter,1751_06_20,"June 20, 1751",1751,"Letters from New Spain say,
that the Indians in several Parts
of the Kingdom have rebelled
against the Spaniards; and that
some of the Magistrates have
been murder'd by the Rebels,
who afterwards drank the
Blood",indigenous rebellion against the spaniards,"June 20, 1751",nonslave
The Virginia Gazette,1,William Hunter,1751_07_11,"July 11, 1751",1751,"According to Advices from
Genoa, a Plot is likely to be
brought to Light; for the Post-
Boy that goes with the Mail
from Viterbo to Road, was
lately stop'd near Ronciglione
by five Men mask'd, who made
him alight, opened the Mail,
and took out only one Letter,
which they read, sealed it up
again, stung it back into the
Bag, and then told the Post-Boy
he might proceed to Rome. The
same Letters observe, that
Conferences are more frequent
than ever at the Court of Turin,
and his Royal Highness the
Duke of Savoy constantly
presides therein: 'Tis pretended
those Conferences turn chiefly
on military Affairs, and that
some new Regulation, relating
to the Troops, will speedily be
published. April 16. Last Saturday came
an Account from Spain, that the
Court had received Advice
from New Spain, that a second
Insurrection had happened
there, and that the Populace
having got the better of the
Governor of Peru's Party, took
him out of the House, and
publickly executed him, by
cutting his Head off.",also indigenous rebellion against the spaniards,"July 11, 1751",nonslave
The Virginia Gazette,1,William Hunter,1751_09_12,"September 12, 1751",1751,"of FRIENDS and
ENEMIES.
NO Virtue is more frequently
mentioned, and less practised
than Friendship. Every Man
imagine he has Friends; yet
every Man may here find
himself deceived. What we
generally call Friendship is a
spurious Virtue, that vanishes
in Time of Trial. Adversity is
the Touchstone of Friendship,
King Tarquin declared it owing
to his Misfortunes, and
Banishment, that he ever
discovered who were his
Friends, or Enemy; before he
could then no longer oblige
them. Such Observations have
opened the Eyes of others,
upon finding themselves
deserted in Misfortune by those
they esteemed their fastest
Friends. Aulus Gellius has
preserved to me an elegant
Fable of AEsop, to this
Purpose.
""A .
Malevolence must be carefully
avoided, he followed, in
chusing a middle Way, betwixt
that of Friendship with all we
meet, and of suspecting every
Month. It is in g a Polly to
believes no Body, as every
Body.
Friendship is often confounded
with a Party a Men f join
Instead of uniting in Virtue. Let
a Thing be good, it if carried
too far. All the Virtue have their
Lucks, should never be passed.
Genuine Friendship com in the
close Union of two or those
Persons, who inwardly love
and each other's Welfare as
their own, in all god and
Designs only: Otherwise the
Junction loses the Name and
Nature of Friendship; and turns
to Combination and
Conspiracy. If one Man obliges
himself to and justify all the
Actions of another, whether
they be good or bad night or
wrong; this is not Virtue or
Friendship, but Vice and V. For
there can be no Friendship but
betwixt good Men. When had
Men unite in the same Desires,
Fears, Animosities,
Endeavours, and E; this is not
Friendship, but Combination or
Faction. It is a goo Error, to call
this Kind of Junction,
Friendship; and arises from the
Propensity of the Vulgar, to
confound Virtues and Vices.
The People look upon
Friendship as an offensive and
detective on all Occasions,
good, bad and indifferent.
When a Drunkard, a an
Adulterer &c. is accused; these
Vulgar Wretches think it their
Duty to defend, or bring of
their Friends; and censure those
who will not endeavour to
blanch and conceal such
Enormities. But, if this be
Friendship, the patronizing of
Thieves and Robbers is Virtue.
According to these bad
Principles, the famous
Cartouche was a Hero, who
suffered the several Penalties,
for some Years, without
betraying this Gang; thinking
the Law of Friendship required
this obstinate Behaviour. Yet
many among the Vulgar
admired and praised this sturdy
Resolution, as a Sign of one
Courage and Friendship.
Daily Experience shews, that
few Men distinguish betwixt
Friendship and Conspiracy.
Even Philosophers, and the
Learned, have been guilty of
this Error. Chiton, one of the
seven wise Greeks, once
doubted h to behave as a Judge,
in an unjust Cause of his
Friend. On the one Side, he
considered the Transgression of
the Law; and on the other the
Transgrossen of Friendship; so
that he took the Medium
betwixt the Twice Sentence
upon his guilty Friends, but
upon the to acquit him; and
friend he thereby fulfilled the
Duty both of a Judge and
Friend. These the Philosopher
sacrificed his Character of
Honesty to a of friendship: For,
to judge contrary to law or pers
others to same Thing, as to the
Fact; tho' indeed the is the
Crime, because it adds
Counting to Injunction. An
honest Man will not regard the
Person of his Friend, when
appointed his, Judge Yet many
great Men besides Chilon, have
given him this Error; as appears
among numerous Instances,
from the Explanation of
Gullius, upon this very
Procedure of Chilon: For
Gellius thinks, that the
Philosophers took an excellent
middle Way; ""to as to refers
violent with due Bounds."" We
likewise see that Ch himself
was guilt of an Error, in
declaring that ""a Man should
not refuse a small Disgrace, in
Order to procure a great
Advantage to his F."" T vol
insamia, priest.",editorial,"September 12, 1751",nonslave
The South Carolina Gazette,NA,Peter Timothy,1751_09_16,"September 16, 1751",1751,"CHOLERIC and quarrelsome
men are like fire and air, two
jarring elements. Whose
contact produces contention.
The choleric man is a nation
divided against itself, his
reason tor'ring on her throne,
and his are sourly ripe for
rebellion: If he is married, his
will may be compared to a
galley in a tempestroes sea. The
quarrelsome man is industrious
to give affronts; the choleric,
equally so to receive them: An
imaginary contradiction
awakens the of the latter, but
the former will tread upon your
mischief",editorial,"September 16, 1751",nonslave
The Virginia Gazette,1,William Hunter,1751_12_05,"December  5, 1751",1751,"LONDON.
July 6. Yesterday was try'd
before the Court of King's
Benclt, a Cause, in which the
Hon. E W, Esq; was
Plaintiff, and two Attornies
Defendants. These Men were
concerned in forming and
carrying into Execution one of
the blackest Conspiracies that
ever was hatched against the
Character of a Gentleman long
distinguished for the most
unblemished Probity and
inviolable Honour. They were
Accomplices with Pn and K
e, two infamous Vagrants,
who, in Order to extort from
this Gentleman a large Sum of
Money, entered into a
Prosecution against him for a
Crime of the most enormous
Kind, at which Nature
shudders, and from which Mr.
Wwas honourably acquitted.
Pn made his Escape from
New Prison, and Nand K
have fled, Ais now ordered
into Custody, and his Bail
surrendered him in Court. All
the Defendants were sound
guilty, and indeed it is difficult
to conceive a Punishment
sufficiently severe for so
execrable a Plot. The Courage
and Industry of Mr. Win
prosecuting those flagrant
Villains cannot be enough
admired: He has exposed his
Character a second Time to the
Scrutiny of the Publick, and the
Cloud of Calumny thrown over
his Innocence still disperses the
more, and he remains in the full
Possession of his Reputation in
Spite of the lying Malice of
these abandoned Profligates;
nor can it be told without
Indignation that A, though in
the Presence of the Court, and a
Gentleman whose Character he
endeavoured to blast, behaved
with the greatest Impudence,
and a shameless Front peculiar
to himself",,"December  5, 1751",nonslave
The Virginia Gazette,1,William Hunter,1752_01_02,"January  2, 1752",1752,"Sent down for Concurrence.
Read and concurr'd.
Which Resolve passed die
whole Court.
PHILADELPHIA, November 7.
At the Mayor's Court last
Week, Ann Magdalenna
Scanner, the Dutch-woman,
formerly mention'd in this
Paper, who had stain'd her Face
and Arms with Indigo, to
countenance a false Accusation
of Mr. Noble, as having beat
and abused her in a violent
Manner; also Daniel Worins,
who abetted her in said
Accusation; were indicted and
found guilty of Conspiracy; and
sentenced, the Man to pay a
Fine of Fifteen Pounds, and the
Woman to be carted round the
Town, and whipt Thirty-One
Lashes, which was on Saturday
executed accordingly",,"January  2, 1752",nonslave
The Virginia Gazette,1,William Hunter,1752_01_30,"January 30, 1752",1752,"It has been, in all Ages of the
World, the Practice of those
who are desirous to believe
themselves made venerable by
Length of Time, to censure the
new Comers into Life, for Want
of Respect to grey Hairs and
sage Experience, for heady
Confidence in their own
Understandings, for hasty
Conclusions upon partial
Views, for a contemptuous
Disregard of those salutary
Counsels, which their Fathers
and Grandsires are always
ready to afford them, and a
rebellious Impatience of that
Subordination to which Youth
is condemned by Nature, as
necessary to its Security from
those Evils into which it would
be otherwise inevitably
precipitated, by the Rashness of
Passion, and the Blindness of
Ignorance",,"January 30, 1752",nonslave
The South Carolina Gazette,NA,Peter Timothy,1752_05_04,"May  4, 1752",1752,"Feb. 11. We learn from the
Southern parts of France, that
the people are in extreme want
of bread insomuch, that in
some places insurrections were
apprehended; and that at
Toulon they have orders to put
all the ships to sea that are now
upon the stocks, as soon as they
are finished, the necessary
directions having been issued
to furnish them with sailors.",,"May  4, 1752",nonslave
The Virginia Gazette,1,William Hunter,1752_07_03,"July  3, 1752",1752,"The Island of Java, which by
our last Accounts from the
East-Indies, the Dutch are
likely to lose, is situated
between 102 and 113 Degrees
of Eastern Longitude, and
between and 8 Degrees of
South Latitude, being about
700 Miles long from East to
West. Most Part of this Island
was under the Dominion of the
Dutch, and besides the native
Javans, is inhabited by Chinese
Malayans, and various other
Nations, transplanted thither by
the Dutch from other oriental
Countries which they had
subdued. The Dutch maintained
such a Fleet of Men of War in
the Ports of Java, that they gave
Law to the Europeans, who
ended in those Seas, as well as
to the Natives, and actually
excluded the English, and all
other Nations from those
Countries where the fine Spices
grow. Java is mountainous in
the Middle, but level and
encumber'd with Boggs near
the Shore, except near Batavia
and Bantam and other Dutch
Colonies, where the Lands are
well drained and cultivated. It
is not one of the Spice Islands,
but produces Rice, Sugar,
Coffee, and such Fruits as grow
between the Tropics. About
thirty Years ago the whole
Dutch Colony was on the Point
of being destroyed by a
Conspiracy among the
Javanese, which was no less
than 7 Years in Agitation, many
Thousand Persons were privy
to it, and yet it did not break
out till a very few Days before
the Time fix'd for putting it in
Execution, which was the 2d of
January 1722. This Conspiracy
was headed by one Erberfield,
the Son of a Dutch Gentleman,
by an Indian Woman, who,
with 18 of his Followers was
put to Death. A more dangerous
Conspiracy broke out in 1740,
by the Chinese, who, by their
superior Skill in mercantile
Affairs, had grown rich and
powerful; and, as the Dutch
gave out, entered into Plots to
dispossess them of the Island.
The Dutch reported that they
were attacked by 90,000 of the
Chinese without the City of
Batavia, and that they had no
Way to secure themselves but
by a general Massacre of the
Chinese within the City, tho' by
delivering up their Weapons,
they were Men entirely naked
and unarmed. This dreadful
Massacre was put in Execution
on the 9th of October 1740, in
which no less than 20,000 Men,
Women, and Children, were
destroyed; and as not only the
Governor but many of the
Soldiers, and others, grew
immensely rich by the Plunder
of the Chinese, it was suspected
that the Wealth of that People
was the grand Inducement
which the Dutch had to fall
upon them. The Dutch in
Europe, indeed, pretended to be
alarmed at the Barbarity of the
Action, and sent Orders to
Batavia to try the Governor for
the Fact; but from this bloody
Deed it may be supposed that
the present Insurrection of the
Chinese takes its Rise.",,"July  3, 1752",nonslave
The Virginia Gazette,1,William Hunter,1752_07_10,"July 10, 1752",1752,"Paris, A-la-Main. April 24.
Last Saturday we received here
the News, that the Inhabitants
of the City of Rouen, to the
Number of 20,000 men, had
revolted, and forcibly entered
into the Convent of Cordeliers
in the City, and into the Corn
Magazines of two private
People, which they plundered.
Their Revolt is attributed to an
Order of the Court, not to sell
Merchandize and Cotton Stuff
any where but in Warehouses,
and to the Prohibition of
carrying them from House to
House; the Workmen finding it
to turn more to their Account to
hawk them about, would
hearken to no Reason upon this
Subject, but revolted. Upon the
first Notice of this Insurrection,
M. de Pontcarre, Premier
President of the Parliament of
Rouen, and M. de la
Bourdonnaye, Intendant or the
Province, who were here, set
out immediately for Rouen.
The Court has likewise sent
two Regiments thither to re-
establish good Order, and we
have just received Advice that
every thing was now restored
to perfect Tranquillity",,"July 10, 1752",nonslave
The Virginia Gazette,1,William Hunter,1752_09_15,"September 15, 1752",1752,"By this Day's Holland Mail we
have Advice, that War has been
actually declared against the
Regency of Tripoli, and that
Court of France is highly
incens'd at the rebellious new
Dey of Tunis, who endeavours
by Threats to force their
Resident there espouse his
Cause, or lose his Head.",,"September 15, 1752",nonslave
The Virginia Gazette,1,William Hunter,1752_10_06,"October  6, 1752",1752,"According to the Report of
devers Persons from the Coast
of Africa, the Civil War rages at
Tunis, and the Regency of
Algeria, which takes Part
therein, has declared for the
Rebels: But 'tis yet doubtful
whether the old or new Day
will come off victorious; for
tho' the Son has gained some
great Advantages, and, besides
the Algerines, the greatest Part
of the Troops on Land are for
him; yet the Father's Party is
still considerable: The greatest
Part of the Raiz at Sea hold
firm to him, and declare they
will undertake every Thing in
their Power in his Favour. The
Retreat of these Raiz, who are
gone to succour the old Day,
renders the Sea more free, and
is of great Use to our
Commerce: But what does the
greatest Service to Navigation
in general, is the Declaration of
War by France against the
Tripolitans.",,"October  6, 1752",nonslave
The Virginia Gazette,1,William Hunter,1752_10_12,"October 12, 1752",1752,"NEWBRN, August 28.
About a Fortnight ago, was
committed to Goal in this
Town, Four Men, viz. Patrick
Moore, a Taylor by Trade,
Daniel Johnson, alias Dixon, a
Chymist, or Doctor, William
Jillet, a Blacksmith, and Peter
Matthews: for making bad
Money: They were taken by the
Sheriff of this County, at Peter
Matthews's House, about 30
Miles from this Town hear to
which, in a great Swamp, they
had erected a Forge, and
prepared Moulds and other
Materials for making
Doubloons, Pistoles, Pieces of
Eight, and half Pistereens:
There were some of the
Doubloons, a Pistole, Pieces of
Eight, and half Pistereens
found upon them, but so badly
done as not to be easily
imposed upon any Body; which
may be owing to the timely
Discovery of the Plot, which
prevented their finishing them
in the Manner they intended;
for the Similitude as to Size, is
very exact, only they are much
wanting is Colour, which
perhaps was to have been the
finishing Stroke. Patrick
Moore, who upon his
Examination, seems to give the
clearest Evidence, says, That he
liv'd in Virginia, and work'd at
this Trade, at the House of one
Richard Booker, in Glocester
County, where the said Daniel
Johnson, alias Dixon, and
William Jillet, resorted; that the
said Booker gave him the said
Moore and small Boat, with
Provisions sufficient, to bring
the said Johnson, alias Dixon,
and William Jillet, with their
Bellows, Hammers, Moulds,
and other Materials for making
Money, into this Province;
which he accordingly did about
two Months since, and landed
them up Neuse River, from
whence they traveled to the
House of the said Peter
Matthews, as above, set up
their Forge, and were
proceeding to the good Work;
and would, in all Probability,
have plyed us plentifully with
Doubloons, Pistoles, and Pieces
of Eight, had not the Plot been
timely discovered.",plotting,"October 12, 1752",nonslave
The South Carolina Gazette,NA,Peter Timothy,1752_10_16,"October 16, 1752",1752,"Letters from Petersburg of the
7th N. S. advite, that they have
lately and several fires is that
city, but of not great
consequence: and the better to
guard against the effects of
such accidents, the government
has ordered of soldiers to patrol
about the streets in the night:
every quarter of the town is
ordered to keep an engine of
pump, and all housekeepers are
charged to have four full of
water at the dear, and on the
house top. By the letters we are
of an insurrection of the at
some villages near on divers or
ill grounded are texts, open
which the government had been
to march several regiments that
way at the returned to their
duty",,"October 16, 1752",nonslave
