newspaper,newspaper_ID_histCommons,printer,print_location,date,written_date,year,reference_type,reference_location,author_informant_gender,text,notes
The Virginia Gazette,1,John Dixon and William Hunter,"Williamsburg, Virginia",1775_08_05,"August 5, 1775",1775,editorial ,"Williamsburg, Virginia",male,"WILLIAMSBURG, August 5.

The following is a copy of the address of the Hon. House of Burgesses, at the last session of Assembly, which was transmitted to the Governor whilst he resided on board the FOWEY man of war, in answer to his Excellency's message inserted in this gazette of the 17th of JUNE

MY LORD,

THE House of Burgesses received your Lordship's written message of the 10th instant, in answer to the joint address of his Majesty's Honorable Council and this House, with equal concern and amazement. We were totally unprepared for so severe and cruel a return to the respectful application made to your Lordship, solely ducted by our duty to his Majesty, and the most earnest desire of contributing every thing in our power towards promoting, as well your Lordship's own happiness, as that of your Lady and whole family. This step, we hoped, would have proved the happy means of restoring that tranquility and harmony, you were pleased to flatter us with your earnest wishes to have established. Who were the peculiar objects of your tenderness, that you so kindly in favour to them, declined a particular enumeration, we know not, but are sorry that your Lordship had so little feeling for the honor, and integrity, of this House. Your have now, my Lord, driven us to the disagreeable necessity of inquiring minutely into the causes of the late disturbances in this country. It is not with the most distant inclination to give your Lordship the slightest umbrage that we engage in so irksome a task, but purely to do justice to our much injured country, that we recur to different, ands some distant, transactions. The charges of disloyalty and disaffection in our countrymen to our most gracious Sovereign, and his government, as insinuated in your Lordship's message, and some other public acts, are as grievous as they are unmerited. Words, we know, are too often but empty sounds. We appeal not to our processions, however sincere, but to facts, of public notoriety. The loyalty of this his Majesty most ancient colony stands concussed, as recorder by many of your worthy predecessors. We will presume to carry your attention no further back that to the administration of a Governor immediately preceding your Lordship. Previous to his coming over to Virginia, there has arisen some unhappy disputes between Great Britain and the colonies. His Majesty was graciously pleased to send over to us, from his immediate presence, the truly noble Lord BZOTETOURT, who told us, that he had received it in command from his Majesty to do justice, and maintain the rights of all his subjects. He cheerfully entered upon the duties of his exalted satin, in which he acted as a true representative of his royal master, at once supporting the dignity of his crown, dispensing the utmost justice, and diffusing benevolence throughout the country. By his exemplary conduct, in all respects, he accomplished what he deemed a glorious work; He gave us tranquillity, and happiness. Indeed he was often heard to declared, that the business of a Governor of Virginia was much easier than he could have conceived, as he found that the government almost executed itself. Matters were not yet that time carried on, and precipitated, with so high an hand, on the other side of the water, as at present. This probably was owing to his minutely examining every subject to the bottom himself, taking nothing upon trust; to his discountenancing tale-bearers, and malicious informers; and, at last, making a faithful representation of things, as he found them. In a short, too short a time, for the happiness of Virginia, it pleased God to remove him from us. When we received the account of your Lordship's appointment, we indulged the pleasing hopes that we should again be made happy in a ruler; and, when you were pleased to honour us with your presence, we vied with each other in endeavouring to make your administration easy and agreeable. Upon the report that your Lady and family were coming over to you, every one, we believe, who heard it, was eager in expectation of an event which was likely to give addition to your happiness. We received her Ladyship, and your children, with every expression of heart-felt joy, and have considered our countrymen as exceedingly happy in having such respectable pledges amongst them. Changes, my Lord, seldom happen without some sufficient cause. If, therefore, you have, or think you have, discovered any alteration in the sentiments or behaviour of those you preside over, it may be worth vour while, as well as ours, to search out the reason of it. Respect, my Lord, is not to be obtained by force, from a free people. If genuine, it must be a perfect volunteer; and nothing is so likely to ensure it to one in your station as dignity of character, a candid and exemplary conduct. We decline, on this occasion, a discussion of the subject unhappily in dispute between Great Britain and the colonies. We presume not to interfere with your authority in summoning or dissolving Assemblies, when, by advice of your Council, you think there is proper occasion. What we claim, as an act of justice, is, that our conduct should be fairly and impartially represented to our Sovereign. We do not mean to insinuate that your Lordship would, designedly, misrepresent facts; but it is much to be feared that you too easily give credit to some designing persons, who, to the great injury of this community, possess much too large a share of your confidence. We have seen, my Lord, the copy of a letter you were pleased to write to the Earl of Dartmouth, dated the 29th of May 1774. The design of then Assembly was entirely misconceived, and the ill impressions your Lordship's letter may have made on the minds of his Majesty, and his Ministers, prove how dangerous it is, and how very unjust it may be, to attempt penetrating the thoughts of others, when they are not certainly known. Suspicions, we humbly conceive, can never justify direct and positive accusations. Men, we know, differ in religious sentiments dome may believe in the superintendence of a providence, and that the care, especially of nations, is an object of Divine Goodness; whilst others may think, or affect to treat this, as well as other matters, which our religion teaches, as thing merely chimerical. We have likewise seen an authentic copy of extracts of another of your Lordship's Letters to the same noble Earl, dated the 24th of December 1774. The more injurious the unfavorable representations, contained in this letter, were likely to be to this country, the more careful we should have hoped your Lordship would have been in examining the evidences of the facts stated. Your Lordship had been pleased to represent, in the first letter, our House of Burgesses as fond of having it thought that a determined resolution to deny and oppose the authority of Parliament always originates with them. Whether this was intended to draw down the particular resentment of Parliament of this country, your Lordship can best determine. They have, indeed, protested against the power of Paliament, when they though it extended contrary to the principles of the constitution; but we do not know that they every affected to take the lead of the other colonies, in this, or any other measure. The times of entering their protestations were merely accidental, as circumstances happened; and it is notorious, that the subject of the present complaint had been under the consideration of some other colonies, before the Virginias took it up It would seem, form your Lordship's letter of the 24th of December, that the association adopted by the General Congress was first recommended from Virginia; whereas the truth is, that, in Virginia, nothing more was resolved against, at first, than the importation and use of East India commodities. The general non-export and non-import agreement came first recommended to us from several of the northern colonies. This, we own, makes no difference now, as the several colonies have united in the association. It is only remarked, since this circumstance seems to have been thought material, as no strong testimony of a kind disposition in your Lordship towards this country. That committees were chosen, in the several counties, is admitted. The design of them was to observe the conduct of those who were inimical to the interest of the country. They were required to publish the names of all transgressors, that the country might know their friends from their foes. This you were pleased to term ""inviting the vengeance of a lawless mob to be exercised upon the unhappy victims."" You further represented these committees as assuming an authority to inspect the books, invoices, and all the secrets of the trade and correspondence of merchants. This, my Lord, was high colouring of assumed facts; which we, who inhabit different parts of the country, are strangers to. To close your narrative upon this head, you were pleased to inform your noble correspondent, that every ""county in this colony was arming a company of ""men, whom they call an independent company, for the avowed ""purpose of protecting their committees, and to be employed ""against Government, if occasion require; and that the committee ""of one county had proceeded so far as to swear the men of ""their independent company to execute all orders which should ""be given them from their committee."" These, my Lord, are things entirely without our knowledge; and upon the strictest inquire, we are convinced they deserve no credit. There were a few companies of Gentlemen formed who were desirous of perfecting themselves in military exercise; but we find not more than six or seven throughout the whole colony, which consists of sixty one counties. This was designed to distinguish them from the militia at large; the first, and most considerable of these, was instituted for the better protection of the inhabitants of Norfolk borough, and afterwards received your Lordship's approbation, so far, that you expressed the warmest wishes that the example might be followed throughout the country, and gave commissions to their officers. That these companies were connected with the committees, or that they were ever designed to act against, or in any sort to interfere with, what you are pleased to call government, we do not, know, or believe, but, on the contrary, we are verily persuaded that they were always ready and willing to exert themselves to support the laws, and his Majesty's government, to the utmost of their power. Your Lordship's assertion, that the ""power of government was entirely disregarded, if not wholly ""overturned, and that there was not a justice of the peace in ""Virginia who acted except as a committee man,"" we cannot but consider as highly unjust, and extremely injurious to us. We have the greatest reason to believe, having it in full proof, that the magistrates throughout the colony duly attended their respective courts; and though, for the reasons assigned in our former address to your Lordship, they could not think themselves legally authorised to hear and determine civil suits, yet we are persuaded that their former endeavours to preserve the peace and good order of government were not interrupted, but exerted in the usual manner. The original cause of suspending the trials of civil disputes was, as your Lordship observes, the want of a see bill. This legal defect was, as your much lamented, and not used, that we know of, as a popular argument, by any man of good sense; nor did the inhabitants of this country join, in what your are pleased to call an opprobrious measure, to engage their"" English ""creditors to join the clam ours of this country. Your Lordship's assertion, that ""not a few did it to avoid paying their ""debts, in which many of the principal people here are much involved,"" we can only answer for ourselves in the negative; and must consider so indiscriminate a charge as extremely injurious. We were so far from desiring to do injustice to creditors, that it gave us great pain to observe that such a step was thought necessary; and nothing but the hopes of being relieved from the arbitrary system of colony government, attempted to be introduced, could have prevailed with us to submit to a stoppage of our exports. The merchants of London, in their written message, by a respectable member of their body, to the committee of the House of Commons, have done us ample justice in this respect; by representing, that they should have no uneasiness about remittances from America, unless Parliament pursued such means as were likely to prevent them. The Congress, my Lord, we consider as instituted on principles of public necessity; we do not deny our having a proper respect for that body; we learn, from good authority, that their humble and dutiful petition to his Majesty was graciously received, though, it is with concern, we are told it has hitherto produced no good effect: But that the inhabitants of Virginia treated with marks of reverence the laws of the Congress, ""which they never bestowed on their legal government, or ""the laws proceeding from it, is one of a great number of facts requiring proof; since we must take leave to say, with confidence, that his Majesty's subjects of Virginia have been second to none others, even to his dutiful and loyal subjects in any part of his wide-extended dominions, in all due respect to his government, Governors, and all in authority under him.

We cannot but remind your Lordship of the General Congress held in America, with the royal approbation, in the last war. The united interest indeed of Great Britain, and the colonies, might have then demanded it. In imitation of so laudable an example, America resolved on a like measure, as equally, if not more necessary, at this critical juncture. Your Lordship's account of the effects the association is likely to produce, considering it as a matter of opinion, we are little concerned to interfere with. Time only can discover the consequences of it; but your heavy charge against those called people of fortune, ""that they supply themselves and Negroes for two or three years, to the distresses of the middling and poorer sort,"" must have proceeded from your giving too easy credit to ill-founded reports. Some, but very few, may have supplied themselves, as opportunity offered, for the present year. This, we believe, is the most that has been done; and we are persuaded of a material mistake in another respect, it is being the general opinion, founded on good grounds, that the middling and poorer sort will fare much better than those of fortune, who have large numbers of slaves to provide for. Engaged on this topick, we cannot refrain from observing how strangely our views have been misrepresented. By the association, we intend nothing that is illegal; we are only resolved to be content with our home-spun manufacturers, however mean in quality, unless things can be restored to their former channel, the only security we desire for what we know our excellent constitution entitles us to. What your Lordship is pleased to represent as the arbitrary proceedings of the committees, we trust will produce none of those very dreadful effects you have painted in such alarming colours. The whole colony, very few excepted, is united: and, from such union of sentiments, expectations must be exceedingly sanguine, indeed, in supposing that discord will arise.

How the proceedings of the General Convention, in the month of March last, may have been represented, we know not; but, from the foregoing specimens, it is to be presumed in no very favourable light. These meetings, my Lord, unless it can be supposed that a whole country could entirely lose sight of its security and most essential interests, were rendered absolutely necessary, first by the dissolution, and afterwards by repeated prorogations, of the General Assembly. Upon inquiry into the state of the colony, it was found that there had been almost a total inattention to the proper training and disciplining of our militia. Various subsequent acts of our legislature, amendatory of the law of 1738, had expired; the act providing against invasions and insurrections was near expiring, and it was uncertain whether an opportunity would be given the General Assembly to revive it. Taking a further view of our situation, it was found that our inhabitants were exposed to the incursions of a barbarous and savage enemy. From the best accounts received from Great Britain, there was too much reason to be convinced that his Majesty's Ministry were prosecuting the most rigorous and arbitrary measures towards subjugating the whole continent of America to their despotic rule; which measures, it was more than probable, had been suggested from hence, and the other colonies: That a scheme, the most diabolical, had been meditated, and generally recommended, by a person of great influence, to offer freedom to our slaves , and turn them against their masters. The Convention, to guard against these dangers, not clearly seen into before that time, recommended a strict attention to the militia law of 1738; but, thinking this defective in many essential points, considering that, under this law, the whole militia were not obliged to exercise so frequently as might be necessary, it was recommended that volunteer companies should be formed in each county, for the better defence and protection of the whole country. These proceedings, according to an usual style, it is more than probable, have been represented as designed to oppose government; whereas, we are persuaded, that nothing was farther from the intentions of the Convention. A review of their resolutions must convince every unprejudiced mind that the utmost respect was paid to his Majesty and his legal government, and that the Convention had much pleasure in expressing their obligations to your Lordship for your late services. The truth is, my Lord, that his Majesty's dutiful subjects in this colony have the utmost attachment to their sovereign; they admire, they love the constitution, and will risk every thing most dear and valuable in support of it. These are principles imbibed in their infancy, and their constant care is to inculcate them inculcate them upon the minds of their children; they meditate or design nothing in the least offensive: But, if it is expected that they should sit down supinely, and submit to yokes which neither they nor their forefathers were able to bear, they must acknowledge that they have the sensibility and feelings of freemen, actuating them to a proper and justifiable defence of those rights which are guarantied by the laws and principle of the constitution.

We have, my Lord, made the strictest and minutest inquiry into the causes of the late disturbances. We find, firms the examination of many respectable merchants natives of Great Britain, residing in different part of this colony, and from other Gentlemen of character, that the country was in perfect state of tranquility till they received an account of your Lordship's removal of the gunpowder from the public magazine, to one of his Majesty's ships of war, and of your irritating and most unjustifiable threats.

The inhabitants of this country, my Lord, could not be strangers to the many attempts in the northern colonies to disarm the people, and thereby deprive them of the only means of defending their lives and property. We know, from good authority, that the like measures were generally recommended by the ministry, and that the export of power from Great Britain had been prohibited. Judge then how very alarming a removal of the small stock which remained in the public magazine, for the defence of the country, and the stripping the guns of their locks, must have been to any people, who had the smallest regard for their security. The manner, and time, of doing it, made no small addition to the general apprehension of your Lordship's views. The reason assigned by your Lordship for taking his step, we should have thought the most likely, at any other time, to have directed a very different conduct. We should have supposed, that a well-grounded apprehension of an insurrection of the slaves ought to have called forth the utmost exertions to suppress it. The world will probably judge your Lordship's method of doing this, the least likely to effect the necessary purpose. Your Lordship having represented this powder as the King's peculiar property, supposing it to have been brought from one of his ships, we have made inquiry into that matter, and cannot find that there ever was any powder brought either from the Rippon or any other man of war; so that we presume your Lordship must have been misinformed as to this fact, since the powder was removed, as it was not relied on in your answer to the address of the corporation of the city of Williamsburg. Be this, however, as it may, we conceive the case would not be materially altered. We must remind your Lordship, that, by a very ancient law of this country, enacted so long since as the thirty second year of the reign of his Majesty King Charles the second, for raising a public revenue; and for the better support of this government, amongst other provisions, an impost of one half pound of new gunpowder, and three pounds of leaden shot, or one shilling and three pence sterling, was imposed on all ships or vessels coming into this colony. In the ninth year of the reign of Queen Anne, the impost of one shilling and three pence on the tonnage of vessels was continued, for port duties. It is evident, my Lord, that the original and chief design of this particular impost was to provide, from time to time, a proper stock of munitions for the defence of the country. We have examined the produce of this fund for thirteen years past, and find that it yielded in that time twenty eight thousand five hundred and three pounds three shillings and ninepence sterling, which, on an average, amounted to 2192 l. . sterling per annum; and it is observable, that for the four last years it yielded considerably more than three thousand pounds in each year. It may from hence be fairly submitted, whether it was not incumbent on the executive part of government to have provided, in the first place, from so large and ample a fund, a proper stock of arms and ammunition, which was so essentially necessary for the security of the country. If, my Lord, instead of applying a reasonable part of this money to such necessary purposes, the whole has been applied to other occasions of government, and powder and arms had been procured through some other channel. we should presume that these. then stored in the public magazine, built at the expense of the country, and appropriated to the safekeeping of all military stores, ought there to have remained, till the exigencies of the country demanded them.

We find, my Lord, that the inhabitants of the city of Williamsburg, in the midst of which the magazine in situated, upon discovering that the powder was removed, the time and manner of its being done, in the dead of night, under an escort of armed marines, commanded by Capt. Henry Collins of the Magdalen, were exceedingly alarmed; that many of them were so exasperated that they had recourse to arms, intending, as we understand, to compel Capt. Collins to restore the powder; but we cannot discover that the least insult was intended to your Lordship. We find that the Corporation of Williamsburg presented a very decent and respectful address to your Excellency, desiring that you would be pleased to order the powder to be returned; and, on receipt of your verbal answer, amongst the other things, avowing that it had been removed by your orders, under which Capt. Collins had acted, and promising that it should be returned in case of an insurrection , the people assembled were soon appeased, returned quietly to their respective homes, and perfect tranquility was restored in the city; that in the succeeding night, on a report that a number of armed men had landed ad a ferry about four miles from the city, the inhabitants were again much alarmed; but, upon the interposition of some Gentlemen, they were quieted, and nothing farther was done than strengthening the usual patrol for the security of the city. We farther find, that on the next day, when every thing was perfectly quiet, your Lordship sent a message into the city by one of the magistrates, which you delivered with the most solemn asseverations, that if any insult was offered to Capt. Foy, or Capt. Collins, you would declare freedom to the slaves , and lay the town in ashes; and that you could easily depopulate the whole country. What could have provoked your Lordship to this we cannot discover, as both Captain Foy and Captain Collins, and several other officers, had been frequently seen walking publicly in the streets, and no one offered either of them the least injury; nor can we discover any reason to believe that any thing of the sort was intended. The inhabitants, my Lord, could not but be exceedingly alarmed at so cruel a threat; many people considered it as part of that general plan, they had heard was recommended in England, and which was discovered by your Lordship through accident; they however, did nothing more, that we can learn, than continue their former patrols. A report of these several matters having soon circulated throughout almost the whole country, with this addition, that the most valuable guns in the magazine had been striped of their locks, and that the inhabitants of Williamsburg were in the most imminent danger, the minds of the people in general were much agitated; they assembled in different quarters, and a number of express were sent to inquire and obtain a true state of things. It appears, that, during this general uneasiness, an account was received from the northward of the engagement at Concord; the General, it seems, had sent an armed force to seize a provincial magazine. This, your Lordship may suppose, increased the apprehension of our people, as it held out to them an additional proof that the steps you had taken formed a part of that general system adopted to render the colonies defenceless. If, upon such alarm, when the minds of the people were fretted to an extreme degree, some irregularities were committed, the cause may be found in those extraordinary attempts to stretch the powers of government so much beyond their ancient and constitutional limits. It gave the greatest concern, my Lord, to all acquainted with your most amiable Lady, and her distinguished character, to hear that she had removed with her children to ore of the King's ship. We have inquired into the cause of this; and though we do not presume to prescribe to her ladyship, yet we are persuaded, that, had she known the sentiments of all ranks of people in this colony, every uneasiness would have been removed. We find, my Lord, that from the great pains taken by the magistrates, and other inhabitants of the city of Williamsburg, there could have been no real ground for fear at the time of her Ladyship's removal, unless it was produced from your Lordship's threats, which might have kept the minds of some of the citizens in suspense. A few Ladies, it appears, left the city; but it was not through apprehensive of any other danger than what your Lordship held over them. The inhabitants certainly could have entertained no suspicious of injury from their friends in the country. Who had kindly offered to come to their assistance; so that it was in the power of your Lordship, alone, to have removed her Ladyship's uneasiness.

It gives us the greatest pain, my Lord, to find, in your Excellency's message, so determined a resolution to pursue a course the most likely to revive the uneasiness of the people, and prevent that restoration of harmony for ardently wished for by all good men. You are pleased to submit to our ""judgment, whether you could reasonably have expected any good effect from communicating the ground of your uneasiness to us."" We give it as our opinion, that your Lordship had the greatest reason, if you had viewed our conduct in its proper light, to have expected the best effects from such communication, as we met your Lordship in General Assembly with the sincerest dispositions to do every thing in our power to provide for the tranquility of the country. The reasons assigned for your contrary apprehensions, we are persuaded, must have been suggested to your Lordship by some designing, malevolent informer. We can hardly suppose your Lordship could have had any well-grounded fear of personal danger, when it is notorious that you appeared publicly, as usual; and it is in proof to us, that the same night in which you left the palace, you walked alone to the Attorney General's, at the distance of upwards of a quarter of a mile, and returned unmolested; and we cannot discover that even the slightest insult was offered. If you judge of the disposition of the House of Burgesses, as to public matters, from their declining to accept an invitation to dine with your Lordship (the instance of respect and civility alluded to, and which you say you had been forward in offering to them) you have entirely mistaken their motives. A piece of civility of this sort had formerly its due weight with us; but we have little reason to suppose that such a ceremony would, at this time, be attended, on your Lordship's part, with that cordiality which we thought we had observed on former occasions. How could your Lordship think of admitting to your table a set of men, whom, together with the whole body of their constituents, you had endeavoured to paint in such despicable and odious colours? That the House of Burgesses ever countenanced the violent and disorderly proceedings of the people, we must, in justice to ourselves, take leave to deny. As to the magazine's being rifled, which you are pleased to insinuate was done with the approbation of the House, we must say, that in this also the greatest injustice is done to us. The House was sitting, closely engaged in public business, when this affair happened. Some of our members, as we believe the truth is, upon hearing what was going forward at the magazine, went up in hopes of preventing it. We are informed, that a great concourse of people, from different parts of the country, were assembled, and that many of the arms had been taken out of the magazine. Several of the members, as Private Gentlemen, remonstrated with all the people they met with against such proceedings, and prevailed with them to return what they had taken. When your Lordship was pleased to accuse the House of Burgesses of usurping the ""executive power,"" from what happened on this occasion, we presume it would have been well to have considered with what propriety they could have interfered: Had they made an order for apprehending the persons concerned, who were unknown, it would have been fruitless, and, moreover, a plain departure from the line of their authority. Such a step your Lordship might, indeed, have justly censured, as an usurpation of the executive power. or would your Lordship have recommended to the individual members to have acted as bailiffs, in seizing all offenders they met with? We never have, nor will we ever give countenance to such unjuifiable proceedings as happened that day.

Your acquaintance, my Lord, with mankind, must suggest to you the difficulty there is in restraining an incensed multitude. Many people, the irritation of whose minds had but lately subsided, we understand, had been again greatly alarmed at a late unfortunate accident, which happened to some inconsiderate young men, in their unlawful attempt, my Lord, which we condemn as highly as your Lordship can. But whether some little apology may not be suggested, from that universal anxiety which all mankind have to prepare for the defense of their lives and property, we will not determine; the point is delicate, and we leave the world to judge of it. But the means contrived, in pursuance of your Lordship's orders, by which an unfortunate culprit might probably have been hurried into eternity, without a moment's time for reflection, we conceive, can do no great honour to humanity; which, we should have supposed, would have dictated the necessity of at least giving public that spring- guns were prepared and fixed; which, it is imagined, would have answered every purpose of security too the magazine. Your Lordship's reflections on our committee, and, through them, upon this whole House, we think might have been spared, after what passed early in the session. Had the committee misbehaved, we should not have been backward in taking proper notice of it.",apprehension/knowledge of slave insurrections
