newspaper,newspaper_ID_histCommons,printer,print_location,date,written_date,year,reference_type,reference_location,author_informant_gender,text,notes
The Virginia Gazette,1,William Parks,"Williamsburg, Virginia",1737_04_08,"April 8, 1737",1737,intended insurrection,Antigua and Barbuda,unknown,"In one of our Gazettes,
we gave an Account of a
Plot of the Slaves, against
the white People in
Antigua; and we have
now the following more
particular Account, viz.
Extract of a Letter from
Antigua, Oct. 24.
'Here has been a general Stop
to all Business, occasioned by
the happy Discovery of an
accused Negro Plot, which
should have been perpetrated
on the 11th Instant, the
Anniversary of the King's
Coronation, on which Day the
General usually gives a
handsome Ball to the
Gentlemen and Ladies of the
whole Island; but this was
postpon'd 'till the 30th Instant,
upon Account of the Death of
the General's Son at St.
Christophers some little Time
ago: This was the only
Preservative to all our Lives.
The Plot was thus, viz. One
Court, a Negro Man belonging
to Thomas Kirby, Esq; was the
chief Person in this Affair;
Tomboy, a Negro Man
belonging to Mr. Thomas
Hanston; and Hercules, a
Negro Man belonging to Mr.
John Christophers, were to
have been this King Courts
head Generals; and while the
Gentlemen and Ladies were
diverting themselves at the
Ball, which was to have been
held at Mr. Christopher
Dunbar's new House, they were
to convey a great Quantity of
Gun-powder into the Cellar,
and blow the House up: At the
same Time, this King Court,
Tomboy, and Hercules, were to
head a Party of Font Hundred
Men each; one from the East
End of the Town, one from
Otter's Pasture, and one from
Morgan's Pasture, all armed
with Cutlasses, and to fall on
all the Whites in the Town,
Men, Women, and Children,
without Reserve, at the same
Time the House blew up, which
was to be a general Signal to
the other Parts of the Island,
(for they were to place
themselves, or at least look out
on several Eminencies, which,
with a false Fire they were to
make at each Place) was to
convey the Signal through the
Island; then the Negros of each
Plantation were to rise and
destroy all the Whites in their
respective Districts, and so
have made themselves sole
Masters of the Island. How this
happy Discovery was made, is
hardly to be accounted for but
some kind Hand of Providence
induc'd the Magistrates to
enquire more strictly into their
Proceedings than usually they
had done, for playingatDice,
&c. which was contrary to the
wholesome Laws of this Island,
they still discover'd more and
more, till at last this Court,
Tomboy, and Hercules being
suspected, for former Crimes
and high Misdemeaners, were
taken up, and after some strict
Examination, found sufficient
Cause to commit them; and still
more and more Evidences
appearing against them, they
were at length convicted on the
19th Instant at Night. The Day
following, King Court was
brought to the Place of
Execution, there was laid
extended on a Wheel, seiz'd by
the Wrists and Ancles, and so
laid basking in the Sun for the
full Space of an Hour and a
Quarter, or more, when he
begg'd Leave to plead; to which
the Justices gave their Assent,
and be acknowledged every
Thing that was alledged against
him, and what his General
Tomboy had confess'd in Prison
the same Morning, when he
was affor'd his Time drew near
for Execution. At last about
Noon, Mr. King Court (for so
they had actually made him,
and bowed the Knee to him at a
very great Feast they had a
little before the Day they
intended to prosecute their
accurs'd Design) was broke on
the Wheel, and his Kingly Cap
and Canopy was found in some
Negro's Possession; Tomboy
was broke on the Wheel on
Thursday, and Hercules on
Friday; their Bones were broke,
and after, their Heads were cut
off, and stuck up on a Pole of
some considerable Height. Four
more of the Heads of these
honest Gentlemen were burnt
the same Dav in Otter's Pasture,
and To-morrow will be Seven
more, and so many as they can
find leading Men in this Plot.
This is all I can say to the
Affair at present, only that it
puts us all into the utmost
Confusion; all our People are
under Arms, and 'tis believed
will continue so till after
Christmas.","Antigua conspiracy; uses the term ""plot"""
The Virginia Gazette,1,William Parks,"Williamsburg, Virginia",1737_05_20,"May 20, 1737",1737,intended insurrection,Antigua and Barbuda,unknown,"Boston, March 15. We have an
Account from Antigua, That
there has been 60 Negroes
executed there, on Account of
their late Conspiracy; that
many of the Executions were
by Burning, and the Rack,
which many of them endured
with Obduracy. Four of these
Wretches were hung upon
Gibbets in Irons, in a
Quadrangle, so that they cou'd
see and speak to one another;
and they blamed themselves for
not putting their intended
Design in Execution sooner:
One of these was taken down,
on his Promise of making great
Discoveries, after he had
endured his Torments to the
Seventh Day; but when he was
nurs'd up, was as stubborn as
ever; and for that Reason
suffered a second Time. Among
those that were burnt, there was
one Grey with Age, that had
but one Leg. The Number of
those yet to be tried, may be
partly conjuctur'd; for there
were Forty add confin'd on
Board of Capt. Sulliff's Vessel,
for want of Prison room. One
of those miserable Creatures,
during his Confinement, by
some Means or other got a
Knife; but being handeuff'd and
pion'd so as not able to come at
his Throat, stbb'd himself in 7
or 8 Places; but the Pain of his
Wounds caus'd him to make
some unusual Noise, whereby
he was discover'd. and
immediately brought to the
Wheel and broke. On the Day
of Capt. Davis's Departure,
Two Free Negroes were
brought to their Trial, whose
Estates are suppos'd to be
worth 2000l. each. The People
are much harrass'd with
Watching; for it comes to every
White Man's Turn to be on his
Guard, and exercise his Arms.
once in 4 Days.
By the Report of the
Gentlemen appointed by the
Governor and Council of
Antigua, to examine into the
Affair of the said Conspiracy, it
appears, That after the
Execution of 12 of the chief
Conspirators, frequent Saturday
Nights Meetings of great
Numbers if Conspirators, had
been for a great while held at
several Places; and that by
drinking a Health in Rum, or
some other Liquors, mixt with
Grave Dirt, and sometimes
Cocks-blood infused, an Oath
of Secrecy and Fidelity had
been taken by many Hundred
Slaves, whereof the Words
were various; but the Tenor was
to stand by and be true to each
other, and to kill the Whites,
Man, Woman, and Child; to
assist in the Execution of this
when called upon by the
Chiefs, and to suer Death,
rather than discover.",Antigua conspiracy
The Virginia Gazette,1,William Parks,"Williamsburg, Virginia",1737_05_27,"May 27, 1737",1737,rebels,Antigua and Barbuda,unknown,"We are in a great deal of Trouble in this Island; the Burning of the Negroes , hanging them on Gibbets alive, Racking them upon the Wheel, &c. takes up almost all our Time, that from the 20th of October to this Day, there have been destroyed Sixty fine sensible Negroe Men, most of them Tradesmen, as Carpenters, Masons, and Coopers. I am almost dead with watching and warding, as are many more. They were going to destroy all the white Inhabitants on the Island. —Court, the King of the Negros , who was to head the Insurrection , Tomboy, their General, and Hercules their Lieutenant-General, were all rack'd upon the Wheel, and died with amazing Obstinacy.—Mr. Archibald Hamilton's Harry, after he was condemn'd, stuck himself with a Knife in Eighteen Places, Four whereof were mortal, which kill'd him.—Col. Martin's Jemmy, who was hung up alive from Noon to Eleven at Night, was then taken down to give Information.— Col. Morgan's Ned, who after he had been hung up Seven Days and Seven Nights, that his Hands grew too small for his Hand-Cuffs, he got them out and raised himself up, and fell down from a Gibbet 15 Feet high without any Harm; he was revived by Cordials and Broth, in hopes to bring him to at Confession; but he would not confess, and was hung up again, and in a Day and Night after expir'd.— Mr. Yeoman's Quasby Coomach, jump'd out of the Fire half burnt, but was thrown in again.—And Mr. Lyon's Tim jump'd out of the Fire, and promis'd to declare all, but it took no Effect.—In short our Island is in such a miserable Condition, that I wish I could get any Sort of Employment in England.""",Antigua conspiracy
The Virginia Gazette,1,William Parks,"Williamsburg, Virginia",1739_09_14,"September 14, 1739",1739,rebels,Jamaica,unknown,"Boston, Aug 13. We hear from
Jamaica, that the Negroes who
had submitted to the
Government, had been out and
brought in the rest of the
rebellious Negroes (upwards of
400) upon the some Terms that
they have submitted.",maroons or enslaved rebels being broght to government in Jamaica
The Virginia Gazette,1,William Parks,"Williamsburg, Virginia",1740_01_18,"January 18, 1740",1740,rebels,"Charleston, South Carolina",male,"BOSTON, November 26.
Extract of a Letter from on
board the Squirrel Man of
War, at Charles Town, to a
Gentleman in Boston.
I Let you know, that we have
had the Fortune of taking about
3 Weeks ago, off St. Augustine,
a Spanish Vessel, the Crew
consisting of 9 Men; her Cargo
was Flour, Butter, &c. which
they had bought of Capt. Kip,
of New-York, who is there at
Present, but dares not venture
out, for fear of being made a
Prize. Our Prize had also on
board 700 Ounces of Silver:
Our Captain has used the
Spanish Crew with the utmost
Humanity. We arriv'd here
about Week ago with the Prize;
& shall sail again on another
Cruise in about 10 Days, with
Two or Three Men of War. We
have News, that General
Oglethorpe is going with a
great Army both of Soldiers
and Indians, to take St.
Augustine: This Day our
Captain had a Letter from him,
which was sent with all
possible Haste; which I
suppose is for us to dispatch for
that Place. The rebellions
Negroes are quite stopt from
doing any further Mischief,
many of them having been put
to the most cruel Death, as
Examples to others. The yellow
Fever is abated; but has been
very mortal.",(printed in SC gazette as well) general oglethorpe's resolve on invading Florida; mentions the slaves in rebellion and returning rebellious slaves to SC and Georgian slaveholders
The Virginia Gazette,1,William Hunter,"Williamsburg, Virginia",1752_09_29,"September 29, 1752",1752,rebels,Guadeloupe,unknown,"NEW-YORK, August 17.
By Capt. Tudor, who arriv'd
here last Week from Anguilla,
we have Advice, that the
French Guarda Costa's were
cruising very thick about
Guardaloup and Granterre, and
on Pretence of preventing any
Assistance to a Gang of
rebellious Negroes, attack all
the English Vessels they meet:
—That one Capt. Bass, being
chased by two of them, sought
his Way through, and got off
with his Mast wounded, and the
Wyth of his Topping-list shot
away:—And that Capt.
Symmons, in a Schooner
belonging to St. Eustatia was
drove ashore by one of them, a
Sloop of ten Guns, when the
Men escap'd, but the Schooner
was got off again, and carried
away by the Enemy.","preventing assistance to ""rebellious negroes"""
The Virginia Gazette,1,Alexander Purdie and John Dixon,"Williamsburg, Virginia",1766_03_07,"March 7, 1766",1766,intended insurrection,South Carolina,male,"By Captain Mason, from South
Carolina, we have advice that
the inhabitants there have been
greatly alarmed with the report
of an intended insurrection of
the Negroes to massacre the
white people throughout that
province, which was to have
been put in execution on
Christmas Eve, and during the
Holidays, but was happily
discovered by a Negro woman;
that after the discovery the
inhabitants were under arms
day and night, during the
Holidays, and the strictest
search made to find out the
ringleaders; that circumstances
appeared very strong against
them, many fire arms being
found concealed; and at several
plantations in the country, the
house arms were found to have
their touch-holes plugged up;
that four or five of the
ringleaders were in custody,
and others daily bringing in,
but their trails had not come on
when he sailed,","intended insurrection in South Carolina of slaves to ""massacre the white people"""
The Virginia Gazette,1,Alexander Purdie and John Dixon,"Williamsburg, Virginia",1766_03_28,"March 28, 1766",1766,occurred insurrections,Suriname,unknown,"Private letters from Holland
mention that despatches of
importance had been received
from the Sieur John Rodier,
Governour of Curacoa, from
which uneasy apprehensions
were formed concerning the
safety of the Dutch colony of
Surinam, at present threatened
with the encroachments of the
French, and a fresh revolt of the
rebellious Negroes.","insurrection in suriname; a ""fresh revolt"""
The Virginia Gazette,1,Alexander Purdie and John Dixon,"Williamsburg, Virginia",1767_03_19,"March 19, 1767",1767,occurred insurrections,Grenada,male,"By Captain Dyer, of the Anna
Teresa packet, who arrived here
on Sunday evening last, we
have advice that on the 28th of
December last a brig, bound to
Barbados, from Newfoundland,
run ashore on Need Point, off
Bridgetown, and was entirely
lost. The Captain further
informs us that an insurrection
of the Negroes has happened at
the island of Grenada, where a
body of them, to the number of
six or seven hundred, who had
chiefly deserted from the
French inhabitants, had taken
possession of some
inaccessible mountains, from
whence they made frequent
sallies, and committed terrible
devastations upon their master,
many of whom they had killed.
When Captain Dyer came away
General Melvil had sent a party
of 40 men, with one cohorn, to
endeavour to suppress them,
but with what success Captain
Dyer had not time to learn. ",insurrection in Grenada
The Virginia Gazette,1,Alexander Purdie and John Dixon,"Williamsburg, Virginia",1767_04_16,"April 16, 1767",1767,rebels,Grenada,male,"By Captain Richardson, who
arrived here yesterday, in 33
days from the Grenades, we
hear that the rebellious Negroes
who had fled to the mountains
in that island were entirely
suppressed, the ringleaders
punished, and the others
properly disposed of. He
informs us of a very remarkable
trial in that place, wherein a
French Gentleman and his son
had been tried for the death of a
cooper, supposed to be
murdered on board a vessel, but
that they ware both acquitted.
The cooper had, it is said,
discovered some smuggling of
the Frenchmen, by which, as it
was imagined, he lost his life.
This may induce smugglers to
be a little more free or bold, but
at the same time it may not be
amiss to observe that they may
have a higher tribunal to appear
before hereafter, especially
when murder is the
consequences of their illegal
attachments.",insurrection in Grenada
The Virginia Gazette,1,Alexander Purdie and John Dixon,"Williamsburg, Virginia",1767_10_01,"October 1, 1767",1767,stirring up,"Prince George, Virginia",male,"PRINCE GEORGE, Sept . 28, 1767.

RUN AWAY from the subscriber, the 22d of this instant, three slaves , viz . JUPITER, alias GIBB, a Negro fellow, about 35 years of age, about 6 feet high, knock kneed, star footed, the right knee bent in more than the left, has several scars on his back from a severe whipping he lately had at Sussex court-house, having been tried there for stirring up the Negroes to an insurrection , being a great Newlight preacher, ROBIN, about 25 years of age, a stout fellow, about 6 feet high, has a film over one of his eyes, a sore on one of his shirts, and is brother to Gibb . DINAH, an old wench, very large, near 6 feet high; she has a remarkable stump of a thumb, occasioned by a whitlow, by which the bones of the first joint came out, and is mother to the two fellows. They carried with them a variety of clothes, among the rest an old blue duffil great coat, one bearskin do. a scarlet jacket, and a fine new linen shirt. It is supposed they will endeavour to make their escape to the southward. Whoever takes up, and conveys to me the above slaves , shall have a reward of 50s. for each of the fellows, and 20s. for the wench, if taken in Virginia ; if in any other government, 5l. for each of the fellows, and 40s. for the wench, paid by

GEORGE NOBLE.",runaway slave who was tried for stirring up insurrection
The Virginia Gazette,1,Alexander Purdie and John Dixon,"Williamsburg, Virginia",1767_10_08,"October 8, 1767",1767,stirring up,"Prince George, Virginia",male,"PRINCE GEORGE, Sept . 28, 1767.

RUN AWAY from the subscriber, the 22d of this instant, three slaves , viz . JUPITER, alias GIBB, a Negro fellow, about 35 years of age, about 6 feet high, knock kneed, star footed, the right knee bent in more than the left, has several scars on his back from a severe whipping he lately had at Sussex court-house, having been tried there for stirring up the Negroes to an insurrection , being a great Newlight preacher, ROBIN, about 25 years of age, a stout fellow, about 6 feet high, has a film over one of his eyes, a sore on one of his shirts, and is brother to Gibb . DINAH, an old wench, very large, near 6 feet high; she has a remarkable stump of a thumb, occasioned by a whitlow, by which the bones of the first joint came out, and is mother to the two fellows. They carried with them a variety of clothes, among the rest an old blue duffil great coat, one bearskin do. a scarlet jacket, and a fine new linen shirt. It is supposed they will endeavour to make their escape to the southward. Whoever takes up, and conveys to me the above slaves , shall have a reward of 50s. for each of the fellows, and 20s. for the wench, if taken in Virginia ; if in any other government, 5l. for each of the fellows, and 40s. for the wench, paid by

GEORGE NOBLE.",runaway slave who was tried for stirring up insurrection
The Virginia Gazette,1,Alexander Purdie and John Dixon,"Williamsburg, Virginia",1767_10_15,"October 15, 1767",1767,stirring up,"Prince George, Virginia",male,"PRINCE GEORGE, Sept . 28, 1767.

RUN AWAY from the subscriber, the 22d of this instant, three slaves , viz . JUPITER, alias GIBB, a Negro fellow, about 35 years of age, about 6 feet high, knock kneed, star footed, the right knee bent in more than the left, has several scars on his back from a severe whipping he lately had at Sussex court-house, having been tried there for stirring up the Negroes to an insurrection , being a great Newlight preacher, ROBIN, about 25 years of age, a stout fellow, about 6 feet high, has a film over one of his eyes, a sore on one of his shirts, and is brother to Gibb . DINAH, an old wench, very large, near 6 feet high; she has a remarkable stump of a thumb, occasioned by a whitlow, by which the bones of the first joint came out, and is mother to the two fellows. They carried with them a variety of clothes, among the rest an old blue duffil great coat, one bearskin do. a scarlet jacket, and a fine new linen shirt. It is supposed they will endeavour to make their escape to the southward. Whoever takes up, and conveys to me the above slaves , shall have a reward of 50s. for each of the fellows, and 20s. for the wench, if taken in Virginia ; if in any other government, 5l. for each of the fellows, and 40s. for the wench, paid by

GEORGE NOBLE.",runaway slave who was tried for stirring up insurrection
The Virginia Gazette,1,Alexander Purdie and John Dixon,"Williamsburg, Virginia",1768_05_19,"May 19, 1768",1768,intended insurrection,Montserrat,male,"By Capt. Winter, from
Montserrat, we learn that they
were daily bringing in Negroes
that were concerned in the late
conspiracy there; that on the 2d
instant one of the ringleaders
was sentenced to suffer the
rack, his legs and arms to be
broke, his head to be cut off,
and his body to be burnt, which
sentence was put in execution
two days after; and that two
others of the Negroes had
hanged themselves.",Monsterrat intended insurrection; extract of a letter from London
The Virginia Gazette,1,Alexander Purdie and John Dixon,"Williamsburg, Virginia",1768_06_09,"June 9, 1768",1768,intended insurrection,Montserrat,male,"By Captain Rodgers from
Montserrat we learn, that three
of the Negroes concerned in the
late intended insurrection, had
suffered the rack, two were
burnt, one gibbetted, and one
hanged, besides others that had
destroyed themselves; that
several more were tried, and
found guilty, but sentence was
not passed; and that 70 or 80
still remained on board the
vessels in the harbour, in order
for trial.",Monsterrat intended insurrection concerning; unclear if free or enslaved or freed
The Virginia Gazette,1,Alexander Purdie and John Dixon,"Williamsburg, Virginia",1768_09_22,"September 22, 1768",1768,intended insurrection,Montserrat,unknown,"PHILADELPHIA,
August 29.
A LETTER from St.
Christopher's advises that they
are in terrible confusion at
Montserrat, not only on
account of the late conspiracy
of the Negroes, but with civil
discord and insurrections.
There is a disagreement
between the Governour and
Assembly, and the people being
dissatisfied with the delay in
bringing the Negroes to trial,
with the great and ruinous
expense occasioned thereby,
had risen in a body, destroyed
all the habitations of the free
Negroes, threatened to burn the
gaol with all the Negroes in it
unless immediately brought to
trial, and the commissioners
were in danger of feeling their
vengeance",Monsterrat intended insurrection; appears to be regarding free people of color
The Virginia Gazette,1,Alexander Purdie and John Dixon,"Williamsburg, Virginia",1769_04_06,"April 6, 1769",1769,intended insurrection,Curaçao,male,"Captain Creighton, arrived her
Thursday evening in 6 weeks
frym Curacoa, met with severe
weather on the coast. He
acquaints us that on his arrival
at Curacoa, in December last,
he found the inhabitants greatly
alarmed on a report that their
Negroes had formed a
conspiracy against them;
whereupon guards were
doubled, and necessary
precautions taken to suppress
the attempt, but that when he
left it the island seemed to be
settling into quiet again. A
Dutch frigat of 32 guns arrived
at Curacoa from Holland and
the coast of Guinea, the 25th of
January. The first instant
Captain Creighton spoke
Captain Atkinson from Virginia
for Liverpool, out three days;
and the 4th spoke a brig from
Surinam for Boston, but the
wind blowing fresh he could
not learn the master's name",conspiracy of slaves in Curacao
The Virginia Gazette,2,William Rind,"Williamsburg, Virginia",1769_08_24,"August 24, 1769",1769,intended insurrection,Jamaica,unknown,"LONDON, May 19.
By the last advices from
Jamaica, we are informed of a
conspiracy being discovered
there among the Negroes, to set
fire to the town of Kingston in
several places at once, and, in
the general confusion, to cut
the throats of the inhabitants. A
black fellow, having an amour
with a mulatto girl, belonging
to a family in the heart of the
town, happily sent her a letter
on the very day it was to
happen, in which he acquainted
her with the design, and
advised her to escape to him, in
order to preserve her life. On
the receipt of which, the girl
acquainted her master with the
contents; and the ringleaders
being taken into custody, the
town was thus saved.","discovered ""conspiracy"" of enslaved to set the town of Kingston on fire"
The Virginia Gazette,2,William Rind,"Williamsburg, Virginia",1770_09_06,"September 6, 1770",1770,intended insurrection,"Beaufort County, South Carolina",unknown,"NEWBERN, August 3.
A FEW weeks ago, we
published an account from
Beaufort county, of the murder
of Mr. Henry Ormond, by his
own slaves; since which we
have received a true account of
that tragical affair, which has
been discovered by the
confession of one of the slaves
in the conspiracy: Five of them
conspired against their master,
and on the Sunday night he was
said to have rode from home in
quest of one of his slaves who
was missing, the conspirators,
after their master was a bed,
went up to his room and with
an handkerchief attempted to
strangle him, which they
thought they had effected, but
in a little time after they had
left him, he recovered, and
began to stir, on hearing which
they went up again, and told
him he must die, and that
before they left the room; he
begged very earnestly for his
life, but one of the, his house
wench, told him it was in vain,
that as he had no mercy on
then, he could expect none
himself, and immediately threw
him between two feather beds,
and all got on him till he was
stifled to death. They the horse
off: Next day he was found as
has been before related. The
slaves have been tried, two
wenches execute, and one burnt
at a slake, one made his escape,
and is not yet taken, the other,
who made the confession, is
saved.",small conspiracy of five enslaved in Beaufort County
